Week,Date,Time,Home_Team,Home_xG,Score,Away_xG,Away_Team,Attendance,Stadium,Referee,Match_Date,Capacity,Day_of_Week,Is_Weekend,Season,Season_End_Year,Position,Played,Won,Drawn,Lost,Goals_For,Goals_Against,Goal_Difference,Points,Capacity_Fill_Rate
1,8/5/2022,20:00,crystal palace,1.2,0:2,1.0,Arsenal,25286,selhurst park,Anthony Taylor,2022-08-05,25456,Friday,0,2022/2023,2023,11,38,11,12,15,40,49,-9,45,0.9933218101822753
1,8/6/2022,12:30,fulham,1.2,2:2,1.2,Liverpool,22207,craven cottage,Andy Madley,2022-08-06,25700,Saturday,1,2022/2023,2023,10,38,15,7,16,55,53,2,52,0.8640856031128404
1,8/6/2022,15:00,tottenham,1.5,4:1,0.5,Southampton,61732,tottenham hotspur stadium,Andre Marriner,2022-08-06,32000,Saturday,1,2022/2023,2023,8,38,18,6,14,70,63,7,60,1.0
1,8/6/2022,15:00,newcastle utd,1.7,2:0,0.3,Nott'ham Forest,52245,st james' park,Simon Hooper,2022-08-06,39595,Saturday,1,2022/2023,2023,4,38,19,14,5,68,33,35,71,1.0
1,8/6/2022,15:00,leeds united,0.8,2:1,1.3,Wolves,36347,elland road,Robert Jones,2022-08-06,39460,Saturday,1,2022/2023,2023,19,38,7,10,21,48,78,-30,31,0.9211099847947288
1,8/6/2022,15:00,bournemouth,0.6,2:0,0.7,Aston Villa,11013,vitality stadium,Peter Bankes,2022-08-06,11360,Saturday,1,2022/2023,2023,15,38,11,6,21,37,71,-34,39,0.9694542253521127
1,8/6/2022,17:30,everton,0.7,0:1,1.5,Chelsea,39254,goodison park,Craig Pawson,2022-08-06,39595,Saturday,1,2022/2023,2023,17,38,8,12,18,34,57,-23,36,0.9913878014900871
1,8/7/2022,14:00,leicester city,0.6,2:2,0.8,Brentford,31794,king power stadium,Jarred Gillett,2022-08-07,32273,Sunday,1,2022/2023,2023,18,38,9,7,22,51,68,-17,34,0.9851578719053078
1,8/7/2022,14:00,manchester utd,1.4,1:2,1.5,Brighton,73711,old trafford,Paul Tierney,2022-08-07,74994,Sunday,1,2022/2023,2023,3,38,23,6,9,58,43,15,75,0.9828919646905085
1,8/7/2022,16:30,west ham,0.5,0:2,2.2,Manchester City,62443,london stadium,Michael Oliver,2022-08-07,60000,Sunday,1,2022/2023,2023,14,38,11,7,20,42,55,-13,40,1.0
2,8/13/2022,12:30,aston villa,2.3,2:1,1.6,Everton,41883,villa park,Michael Oliver,2022-08-13,42682,Saturday,1,2022/2023,2023,7,38,18,7,13,51,46,5,61,0.9812801649407245
2,8/13/2022,15:00,manchester city,1.7,4:0,0.1,Bournemouth,53453,etihad stadium,David Coote,2022-08-13,55017,Saturday,1,2022/2023,2023,1,38,28,5,5,94,33,61,89,0.9715724230692332
2,8/13/2022,15:00,southampton,1.2,2:2,1.8,Leeds United,30815,st. mary's stadium,Tony Harrington,2022-08-13,39595,Saturday,1,2022/2023,2023,20,38,6,7,25,36,73,-37,25,0.7782548301553226
2,8/13/2022,15:00,wolves,0.9,0:0,1.5,Fulham,31178,molineux stadium,John Brooks,2022-08-13,32057,Saturday,1,2022/2023,2023,13,38,11,8,19,31,58,-27,41,0.9725800917116386
2,8/13/2022,15:00,arsenal,2.7,4:2,0.5,Leicester City,60033,emirates stadium,Darren England,2022-08-13,59867,Saturday,1,2022/2023,2023,2,38,26,6,6,88,43,45,84,1.0
2,8/13/2022,15:00,brighton,1.5,0:0,0.2,Newcastle Utd,31552,the american express community stadium,Graham Scott,2022-08-13,39595,Saturday,1,2022/2023,2023,6,38,18,8,12,72,53,19,62,0.7968682914509407
2,8/13/2022,17:30,brentford,1.6,4:0,0.9,Manchester Utd,17051,brentford community stadium,Stuart Attwell,2022-08-13,39595,Saturday,1,2022/2023,2023,9,38,15,14,9,58,46,12,59,0.4306351812097487
2,8/14/2022,14:00,nottingham forest,1.3,1:0,2.1,West Ham,29281,the city ground,Robert Jones,2022-08-14,39595,Sunday,1,2022/2023,2023,16,38,9,11,18,38,68,-30,38,0.7395125647177674
2,8/14/2022,16:30,chelsea,1.6,2:2,1.0,Tottenham,39946,stamford bridge,Anthony Taylor,2022-08-14,41631,Sunday,1,2022/2023,2023,12,38,11,11,16,38,47,-9,44,0.9595253537027696
2,8/15/2022,20:00,liverpool,2.0,1:1,1.0,Crystal Palace,52970,anfield,Paul Tierney,2022-08-15,53394,Monday,0,2022/2023,2023,5,38,19,10,9,75,47,28,67,0.992059032850133
3,8/20/2022,12:30,tottenham,1.7,1:0,0.7,Wolves,61298,tottenham hotspur stadium,Simon Hooper,2022-08-20,32000,Saturday,1,2022/2023,2023,8,38,18,6,14,70,63,7,60,1.0
3,8/20/2022,15:00,leicester city,0.3,1:2,0.9,Southampton,30850,king power stadium,Michael Salisbury,2022-08-20,32273,Saturday,1,2022/2023,2023,18,38,9,7,22,51,68,-17,34,0.9559074148669167
3,8/20/2022,15:00,everton,1.5,1:1,1.0,Nott'ham Forest,39271,goodison park,Andre Marriner,2022-08-20,39595,Saturday,1,2022/2023,2023,17,38,8,12,18,34,57,-23,36,0.9918171486298775
3,8/20/2022,15:00,crystal palace,2.6,3:1,0.9,Aston Villa,22012,selhurst park,Andy Madley,2022-08-20,25456,Saturday,1,2022/2023,2023,11,38,11,12,15,40,49,-9,45,0.8647077309868008
3,8/20/2022,15:00,fulham,2.4,3:2,1.8,Brentford,21798,craven cottage,Peter Bankes,2022-08-20,25700,Saturday,1,2022/2023,2023,10,38,15,7,16,55,53,2,52,0.848171206225681
3,8/20/2022,17:30,bournemouth,0.3,0:3,1.3,Arsenal,10423,vitality stadium,Craig Pawson,2022-08-20,11360,Saturday,1,2022/2023,2023,15,38,11,6,21,37,71,-34,39,0.9175176056338028
3,8/21/2022,14:00,leeds united,2.1,3:0,0.9,Chelsea,36372,elland road,Stuart Attwell,2022-08-21,39460,Sunday,1,2022/2023,2023,19,38,7,10,21,48,78,-30,31,0.9217435377597567
3,8/21/2022,14:00,west ham,0.8,0:2,1.7,Brighton,62449,london stadium,Anthony Taylor,2022-08-21,60000,Sunday,1,2022/2023,2023,14,38,11,7,20,42,55,-13,40,1.0
3,8/21/2022,16:30,newcastle utd,1.8,3:3,2.1,Manchester City,52258,st james' park,Jarred Gillett,2022-08-21,39595,Sunday,1,2022/2023,2023,4,38,19,14,5,68,33,35,71,1.0
3,8/22/2022,20:00,manchester utd,1.8,2:1,1.3,Liverpool,74147,old trafford,Michael Oliver,2022-08-22,74994,Monday,0,2022/2023,2023,3,38,23,6,9,58,43,15,75,0.9887057631277169
4,8/27/2022,12:30,southampton,1.4,0:1,1.1,Manchester Utd,31196,st. mary's stadium,Andy Madley,2022-08-27,39595,Saturday,1,2022/2023,2023,20,38,6,7,25,36,73,-37,25,0.7878772572294481
4,8/27/2022,15:00,manchester city,2.2,4:2,0.1,Crystal Palace,53112,etihad stadium,Darren England,2022-08-27,55017,Saturday,1,2022/2023,2023,1,38,28,5,5,94,33,61,89,0.965374338840722
4,8/27/2022,15:00,brighton,2.0,1:0,1.8,Leeds United,30953,the american express community stadium,Michael Salisbury,2022-08-27,39595,Saturday,1,2022/2023,2023,6,38,18,8,12,72,53,19,62,0.7817401187018563
4,8/27/2022,15:00,chelsea,1.8,2:1,2.5,Leicester City,39953,stamford bridge,Paul Tierney,2022-08-27,41631,Saturday,1,2022/2023,2023,12,38,11,11,16,38,47,-9,44,0.9596934976339747
4,8/27/2022,15:00,brentford,2.1,1:1,1.1,Everton,17009,brentford community stadium,John Brooks,2022-08-27,39595,Saturday,1,2022/2023,2023,9,38,15,14,9,58,46,12,59,0.4295744412173254
4,8/27/2022,15:00,liverpool,3.3,9:0,0.3,Bournemouth,53328,anfield,Stuart Attwell,2022-08-27,53394,Saturday,1,2022/2023,2023,5,38,19,10,9,75,47,28,67,0.9987639060568603
4,8/27/2022,17:30,arsenal,2.6,2:1,0.8,Fulham,60164,emirates stadium,Jarred Gillett,2022-08-27,59867,Saturday,1,2022/2023,2023,2,38,26,6,6,88,43,45,84,1.0
4,8/28/2022,14:00,wolves,0.7,1:1,1.7,Newcastle Utd,31311,molineux stadium,Peter Bankes,2022-08-28,32057,Sunday,1,2022/2023,2023,13,38,11,8,19,31,58,-27,41,0.9767289515550426
4,8/28/2022,14:00,aston villa,0.5,0:1,0.6,West Ham,41796,villa park,David Coote,2022-08-28,42682,Sunday,1,2022/2023,2023,7,38,18,7,13,51,46,5,61,0.9792418349655593
4,8/28/2022,16:30,nottingham forest,0.9,0:2,2.4,Tottenham,29296,the city ground,Craig Pawson,2022-08-28,39595,Sunday,1,2022/2023,2023,16,38,9,11,18,38,68,-30,38,0.7398914004293471
5,8/30/2022,19:30,fulham,0.7,2:1,1.4,Brighton,22224,craven cottage,Thomas Bramall,2022-08-30,25700,Tuesday,0,2022/2023,2023,10,38,15,7,16,55,53,2,52,0.8647470817120623
5,8/30/2022,19:30,crystal palace,1.0,1:1,1.4,Brentford,25043,selhurst park,Simon Hooper,2022-08-30,25456,Tuesday,0,2022/2023,2023,11,38,11,12,15,40,49,-9,45,0.9837759270898806
5,8/30/2022,19:45,southampton,1.1,2:1,1.1,Chelsea,31542,st. mary's stadium,Michael Oliver,2022-08-30,39595,Tuesday,0,2022/2023,2023,20,38,6,7,25,36,73,-37,25,0.7966157343098876
5,8/30/2022,20:00,leeds united,1.0,1:1,1.0,Everton,36338,elland road,Darren England,2022-08-30,39460,Tuesday,0,2022/2023,2023,19,38,7,10,21,48,78,-30,31,0.9208819057273188
5,8/31/2022,19:30,bournemouth,0.4,0:0,1.5,Wolves,10113,vitality stadium,Anthony Taylor,2022-08-31,11360,Wednesday,0,2022/2023,2023,15,38,11,6,21,37,71,-34,39,0.8902288732394367
5,8/31/2022,19:30,manchester city,3.3,6:0,0.7,Nott'ham Forest,53409,etihad stadium,Paul Tierney,2022-08-31,55017,Wednesday,0,2022/2023,2023,1,38,28,5,5,94,33,61,89,0.9707726702655542
5,8/31/2022,19:30,arsenal,2.4,2:1,0.4,Aston Villa,60012,emirates stadium,Robert Jones,2022-08-31,59867,Wednesday,0,2022/2023,2023,2,38,26,6,6,88,43,45,84,1.0
5,8/31/2022,19:45,west ham,1.2,1:1,0.6,Tottenham,62450,london stadium,Peter Bankes,2022-08-31,60000,Wednesday,0,2022/2023,2023,14,38,11,7,20,42,55,-13,40,1.0
5,8/31/2022,20:00,liverpool,1.5,2:1,0.7,Newcastle Utd,53316,anfield,Andre Marriner,2022-08-31,53394,Wednesday,0,2022/2023,2023,5,38,19,10,9,75,47,28,67,0.9985391617035622
5,9/1/2022,20:00,leicester city,0.7,0:1,1.5,Manchester Utd,32226,king power stadium,Craig Pawson,2022-09-01,32273,Thursday,0,2022/2023,2023,18,38,9,7,22,51,68,-17,34,0.9985436742788089
6,9/3/2022,12:30,everton,1.7,0:0,2.1,Liverpool,39240,goodison park,Anthony Taylor,2022-09-03,39595,Saturday,1,2022/2023,2023,17,38,8,12,18,34,57,-23,36,0.9910342214926127
6,9/3/2022,15:00,nottingham forest,1.9,2:3,0.8,Bournemouth,28720,the city ground,Michael Oliver,2022-09-03,39595,Saturday,1,2022/2023,2023,16,38,9,11,18,38,68,-30,38,0.7253441091046849
6,9/3/2022,15:00,wolves,0.8,1:0,1.2,Southampton,30546,molineux stadium,John Brooks,2022-09-03,32057,Saturday,1,2022/2023,2023,13,38,11,8,19,31,58,-27,41,0.9528652088467418
6,9/3/2022,15:00,newcastle utd,2.8,0:0,1.0,Crystal Palace,51863,st james' park,Michael Salisbury,2022-09-03,39595,Saturday,1,2022/2023,2023,4,38,19,14,5,68,33,35,71,1.0
6,9/3/2022,15:00,brentford,2.3,5:2,1.7,Leeds United,17092,brentford community stadium,Robert Jones,2022-09-03,39595,Saturday,1,2022/2023,2023,9,38,15,14,9,58,46,12,59,0.43167066548806665
6,9/3/2022,15:00,tottenham,2.9,2:1,0.7,Fulham,61641,tottenham hotspur stadium,Stuart Attwell,2022-09-03,32000,Saturday,1,2022/2023,2023,8,38,18,6,14,70,63,7,60,1.0
6,9/3/2022,15:00,chelsea,0.9,2:1,1.1,West Ham,39923,stamford bridge,Andy Madley,2022-09-03,41631,Saturday,1,2022/2023,2023,12,38,11,11,16,38,47,-9,44,0.9589728807859528
6,9/3/2022,17:30,aston villa,0.3,1:1,2.1,Manchester City,41830,villa park,Simon Hooper,2022-09-03,42682,Saturday,1,2022/2023,2023,7,38,18,7,13,51,46,5,61,0.9800384236914859
6,9/4/2022,14:00,brighton,2.6,5:2,1.4,Leicester City,31185,the american express community stadium,Tony Harrington,2022-09-04,39595,Sunday,1,2022/2023,2023,6,38,18,8,12,72,53,19,62,0.7875994443742896
6,9/4/2022,16:30,manchester utd,1.5,3:1,1.3,Arsenal,73431,old trafford,Paul Tierney,2022-09-04,74994,Sunday,1,2022/2023,2023,3,38,23,6,9,58,43,15,75,0.9791583326666133
8,9/16/2022,20:00,aston villa,1.5,1:0,0.3,Southampton,40758,villa park,Tony Harrington,2022-09-16,42682,Friday,0,2022/2023,2023,7,38,18,7,13,51,46,5,61,0.954922449744623
8,9/16/2022,20:00,nottingham forest,1.4,2:3,0.9,Fulham,28654,the city ground,Jarred Gillett,2022-09-16,39595,Friday,0,2022/2023,2023,16,38,9,11,18,38,68,-30,38,0.723677231973734
8,9/17/2022,12:30,wolves,0.4,0:3,1.1,Manchester City,31578,molineux stadium,Anthony Taylor,2022-09-17,32057,Saturday,1,2022/2023,2023,13,38,11,8,19,31,58,-27,41,0.9850578656767632
8,9/17/2022,15:00,newcastle utd,1.9,1:1,0.7,Bournemouth,52238,st james' park,Craig Pawson,2022-09-17,39595,Saturday,1,2022/2023,2023,4,38,19,14,5,68,33,35,71,1.0
8,9/17/2022,17:30,tottenham,2.2,6:2,1.8,Leicester City,61450,tottenham hotspur stadium,Simon Hooper,2022-09-17,32000,Saturday,1,2022/2023,2023,8,38,18,6,14,70,63,7,60,1.0
8,9/18/2022,12:00,brentford,0.5,0:3,1.5,Arsenal,17122,brentford community stadium,David Coote,2022-09-18,39595,Sunday,1,2022/2023,2023,9,38,15,14,9,58,46,12,59,0.4324283369112262
8,9/18/2022,14:15,everton,0.4,1:0,1.0,West Ham,39298,goodison park,Michael Oliver,2022-09-18,39595,Sunday,1,2022/2023,2023,17,38,8,12,18,34,57,-23,36,0.992499052910721
9,10/1/2022,12:30,arsenal,2.4,3:1,1.6,Tottenham,60278,emirates stadium,Anthony Taylor,2022-10-01,59867,Saturday,1,2022/2023,2023,2,38,26,6,6,88,43,45,84,1.0
9,10/1/2022,15:00,southampton,1.7,1:2,2.0,Everton,30510,st. mary's stadium,Andre Marriner,2022-10-01,39595,Saturday,1,2022/2023,2023,20,38,6,7,25,36,73,-37,25,0.7705518373532012
9,10/1/2022,15:00,crystal palace,0.4,1:2,1.1,Chelsea,25198,selhurst park,Chris Kavanagh,2022-10-01,25456,Saturday,1,2022/2023,2023,11,38,11,12,15,40,49,-9,45,0.9898648648648649
9,10/1/2022,15:00,liverpool,1.5,3:3,1.4,Brighton,53320,anfield,Andy Madley,2022-10-01,53394,Saturday,1,2022/2023,2023,5,38,19,10,9,75,47,28,67,0.9986140764879949
9,10/1/2022,15:00,fulham,0.5,1:4,3.3,Newcastle Utd,22913,craven cottage,Darren England,2022-10-01,25700,Saturday,1,2022/2023,2023,10,38,15,7,16,55,53,2,52,0.891556420233463
9,10/1/2022,15:00,bournemouth,0.4,0:0,0.9,Brentford,10126,vitality stadium,Thomas Bramall,2022-10-01,11360,Saturday,1,2022/2023,2023,15,38,11,6,21,37,71,-34,39,0.8913732394366197
9,10/1/2022,17:30,west ham,0.9,2:0,0.7,Wolves,62444,london stadium,Paul Tierney,2022-10-01,60000,Saturday,1,2022/2023,2023,14,38,11,7,20,42,55,-13,40,1.0
9,10/2/2022,14:00,manchester city,3.2,6:3,1.7,Manchester Utd,53475,etihad stadium,Michael Oliver,2022-10-02,55017,Sunday,1,2022/2023,2023,1,38,28,5,5,94,33,61,89,0.9719722994710726
9,10/2/2022,16:30,leeds united,0.4,0:0,2.2,Aston Villa,36582,elland road,Stuart Attwell,2022-10-02,39460,Sunday,1,2022/2023,2023,19,38,7,10,21,48,78,-30,31,0.9270653826659909
9,10/3/2022,20:00,leicester city,1.3,4:0,1.1,Nott'ham Forest,32202,king power stadium,Robert Jones,2022-10-03,32273,Monday,0,2022/2023,2023,18,38,9,7,22,51,68,-17,34,0.9978000185913922
10,10/8/2022,15:00,bournemouth,1.1,2:1,1.0,Leicester City,10272,vitality stadium,Michael Salisbury,2022-10-08,11360,Saturday,1,2022/2023,2023,15,38,11,6,21,37,71,-34,39,0.9042253521126761
10,10/8/2022,15:00,newcastle utd,1.5,5:1,1.2,Brentford,52067,st james' park,John Brooks,2022-10-08,39595,Saturday,1,2022/2023,2023,4,38,19,14,5,68,33,35,71,1.0
10,10/8/2022,15:00,manchester city,2.4,4:0,0.2,Southampton,53365,etihad stadium,Andy Madley,2022-10-08,55017,Saturday,1,2022/2023,2023,1,38,28,5,5,94,33,61,89,0.9699729174618754
10,10/8/2022,15:00,chelsea,1.9,3:0,1.1,Wolves,39940,stamford bridge,Simon Hooper,2022-10-08,41631,Saturday,1,2022/2023,2023,12,38,11,11,16,38,47,-9,44,0.9593812303331651
10,10/8/2022,17:30,brighton,0.7,0:1,0.8,Tottenham,31498,the american express community stadium,Tony Harrington,2022-10-08,39595,Saturday,1,2022/2023,2023,6,38,18,8,12,72,53,19,62,0.7955044828892537
10,10/9/2022,14:00,west ham,2.4,3:1,0.7,Fulham,62407,london stadium,Chris Kavanagh,2022-10-09,60000,Sunday,1,2022/2023,2023,14,38,11,7,20,42,55,-13,40,1.0
10,10/9/2022,14:00,crystal palace,1.1,2:1,1.0,Leeds United,25042,selhurst park,Paul Tierney,2022-10-09,25456,Sunday,1,2022/2023,2023,11,38,11,12,15,40,49,-9,45,0.9837366436203645
10,10/9/2022,16:30,arsenal,2.7,3:2,1.1,Liverpool,60059,emirates stadium,Michael Oliver,2022-10-09,59867,Sunday,1,2022/2023,2023,2,38,26,6,6,88,43,45,84,1.0
10,10/9/2022,19:00,everton,0.6,1:2,1.4,Manchester Utd,39258,goodison park,David Coote,2022-10-09,39595,Sunday,1,2022/2023,2023,17,38,8,12,18,34,57,-23,36,0.9914888243465084
10,10/10/2022,20:00,nottingham forest,0.3,1:1,0.7,Aston Villa,29208,the city ground,Anthony Taylor,2022-10-10,39595,Monday,0,2022/2023,2023,16,38,9,11,18,38,68,-30,38,0.7376688975880793
11,10/14/2022,20:00,brentford,1.5,2:0,1.9,Brighton,17016,brentford community stadium,Michael Salisbury,2022-10-14,39595,Friday,0,2022/2023,2023,9,38,15,14,9,58,46,12,59,0.4297512312160626
11,10/15/2022,12:30,leicester city,1.0,0:0,0.4,Crystal Palace,31298,king power stadium,Andy Madley,2022-10-15,32273,Saturday,1,2022/2023,2023,18,38,9,7,22,51,68,-17,34,0.9697889876986955
11,10/15/2022,15:00,fulham,2.1,2:2,1.0,Bournemouth,22541,craven cottage,Graham Scott,2022-10-15,25700,Saturday,1,2022/2023,2023,10,38,15,7,16,55,53,2,52,0.8770817120622568
11,10/15/2022,15:00,wolves,1.3,1:0,1.5,Nott'ham Forest,31554,molineux stadium,Thomas Bramall,2022-10-15,32057,Saturday,1,2022/2023,2023,13,38,11,8,19,31,58,-27,41,0.9843091992388557
11,10/15/2022,17:30,tottenham,2.2,2:0,0.4,Everton,61812,tottenham hotspur stadium,Paul Tierney,2022-10-15,32000,Saturday,1,2022/2023,2023,8,38,18,6,14,70,63,7,60,1.0
11,10/16/2022,14:00,southampton,0.5,1:1,1.7,West Ham,29159,st. mary's stadium,Peter Bankes,2022-10-16,39595,Sunday,1,2022/2023,2023,20,38,6,7,25,36,73,-37,25,0.7364313675969189
11,10/16/2022,14:00,aston villa,1.8,0:2,0.9,Chelsea,41754,villa park,Robert Jones,2022-10-16,42682,Sunday,1,2022/2023,2023,7,38,18,7,13,51,46,5,61,0.9782578135982382
11,10/16/2022,14:00,leeds united,1.8,0:1,0.5,Arsenal,36700,elland road,Chris Kavanagh,2022-10-16,39460,Sunday,1,2022/2023,2023,19,38,7,10,21,48,78,-30,31,0.9300557526609224
11,10/16/2022,14:00,manchester utd,0.8,0:0,0.8,Newcastle Utd,73726,old trafford,Craig Pawson,2022-10-16,74994,Sunday,1,2022/2023,2023,3,38,23,6,9,58,43,15,75,0.9830919806917887
11,10/16/2022,16:30,liverpool,2.1,1:0,1.0,Manchester City,53286,anfield,Anthony Taylor,2022-10-16,53394,Sunday,1,2022/2023,2023,5,38,19,10,9,75,47,28,67,0.9979773008203169
12,10/18/2022,19:30,brighton,1.7,0:0,0.1,Nott'ham Forest,31463,the american express community stadium,Darren England,2022-10-18,39595,Tuesday,0,2022/2023,2023,6,38,18,8,12,72,53,19,62,0.7946205328955677
12,10/18/2022,20:15,crystal palace,1.2,2:1,0.8,Wolves,25125,selhurst park,David Coote,2022-10-18,25456,Tuesday,0,2022/2023,2023,11,38,11,12,15,40,49,-9,45,0.9869971715901948
12,10/19/2022,19:30,bournemouth,1.0,0:1,1.0,Southampton,10405,vitality stadium,John Brooks,2022-10-19,11360,Wednesday,0,2022/2023,2023,15,38,11,6,21,37,71,-34,39,0.9159330985915493
12,10/19/2022,19:30,brentford,1.3,0:0,0.9,Chelsea,17118,brentford community stadium,Jarred Gillett,2022-10-19,39595,Wednesday,0,2022/2023,2023,9,38,15,14,9,58,46,12,59,0.4323273140548049
12,10/19/2022,19:30,liverpool,1.7,1:0,1.7,West Ham,52982,anfield,Stuart Attwell,2022-10-19,53394,Wednesday,0,2022/2023,2023,5,38,19,10,9,75,47,28,67,0.9922837772034311
12,10/19/2022,19:30,newcastle utd,1.5,1:0,0.2,Everton,52247,st james' park,Tony Harrington,2022-10-19,39595,Wednesday,0,2022/2023,2023,4,38,19,14,5,68,33,35,71,1.0
12,10/19/2022,20:15,manchester utd,1.5,2:0,0.6,Tottenham,73677,old trafford,Simon Hooper,2022-10-19,74994,Wednesday,0,2022/2023,2023,3,38,23,6,9,58,43,15,75,0.982438595087607
12,10/20/2022,19:30,fulham,2.1,3:0,1.2,Aston Villa,23508,craven cottage,Michael Oliver,2022-10-20,25700,Thursday,0,2022/2023,2023,10,38,15,7,16,55,53,2,52,0.9147081712062257
12,10/20/2022,20:15,leicester city,0.8,2:0,1.3,Leeds United,30814,king power stadium,Peter Bankes,2022-10-20,32273,Thursday,0,2022/2023,2023,18,38,9,7,22,51,68,-17,34,0.9547919313357915
13,10/22/2022,12:30,nottingham forest,1.9,1:0,1.6,Liverpool,29245,the city ground,Paul Tierney,2022-10-22,39595,Saturday,1,2022/2023,2023,16,38,9,11,18,38,68,-30,38,0.738603359009976
13,10/22/2022,15:00,everton,1.4,3:0,0.9,Crystal Palace,38939,goodison park,Simon Hooper,2022-10-22,39595,Saturday,1,2022/2023,2023,17,38,8,12,18,34,57,-23,36,0.9834322515469125
13,10/22/2022,15:00,manchester city,1.6,3:1,0.5,Brighton,53223,etihad stadium,Craig Pawson,2022-10-22,55017,Saturday,1,2022/2023,2023,1,38,28,5,5,94,33,61,89,0.9673918970500027
13,10/22/2022,17:30,chelsea,1.1,1:1,0.8,Manchester Utd,39503,stamford bridge,Stuart Attwell,2022-10-22,41631,Saturday,1,2022/2023,2023,12,38,11,11,16,38,47,-9,44,0.9488842449136461
13,10/23/2022,14:00,aston villa,2.8,4:0,0.9,Brentford,41693,villa park,Darren England,2022-10-23,42682,Sunday,1,2022/2023,2023,7,38,18,7,13,51,46,5,61,0.976828639707605
13,10/23/2022,14:00,wolves,2.1,0:4,0.9,Leicester City,31425,molineux stadium,Michael Oliver,2022-10-23,32057,Sunday,1,2022/2023,2023,13,38,11,8,19,31,58,-27,41,0.9802851171351031
13,10/23/2022,14:00,leeds united,1.6,2:3,1.8,Fulham,36447,elland road,Anthony Taylor,2022-10-23,39460,Sunday,1,2022/2023,2023,19,38,7,10,21,48,78,-30,31,0.9236441966548403
13,10/23/2022,14:00,southampton,0.7,1:1,1.0,Arsenal,31145,st. mary's stadium,Robert Jones,2022-10-23,39595,Sunday,1,2022/2023,2023,20,38,6,7,25,36,73,-37,25,0.786589215810077
13,10/23/2022,16:30,tottenham,1.6,1:2,1.2,Newcastle Utd,61726,tottenham hotspur stadium,Jarred Gillett,2022-10-23,32000,Sunday,1,2022/2023,2023,8,38,18,6,14,70,63,7,60,1.0
13,10/24/2022,20:00,west ham,1.9,2:0,0.4,Bournemouth,62447,london stadium,David Coote,2022-10-24,60000,Monday,0,2022/2023,2023,14,38,11,7,20,42,55,-13,40,1.0
14,10/29/2022,12:30,leicester city,0.7,0:1,1.0,Manchester City,32223,king power stadium,Robert Jones,2022-10-29,32273,Saturday,1,2022/2023,2023,18,38,9,7,22,51,68,-17,34,0.9984507173178818
14,10/29/2022,15:00,brentford,1.4,1:1,0.6,Wolves,17051,brentford community stadium,Robert Madley,2022-10-29,39595,Saturday,1,2022/2023,2023,9,38,15,14,9,58,46,12,59,0.4306351812097487
14,10/29/2022,15:00,crystal palace,0.9,1:0,1.3,Southampton,25130,selhurst park,Michael Salisbury,2022-10-29,25456,Saturday,1,2022/2023,2023,11,38,11,12,15,40,49,-9,45,0.987193588937775
14,10/29/2022,15:00,newcastle utd,3.4,4:0,0.4,Aston Villa,52233,st james' park,Paul Tierney,2022-10-29,39595,Saturday,1,2022/2023,2023,4,38,19,14,5,68,33,35,71,1.0
14,10/29/2022,15:00,brighton,2.4,4:1,1.4,Chelsea,31746,the american express community stadium,Andy Madley,2022-10-29,39595,Saturday,1,2022/2023,2023,6,38,18,8,12,72,53,19,62,0.8017678999873722
14,10/29/2022,15:00,bournemouth,0.5,2:3,2.0,Tottenham,10430,vitality stadium,Anthony Taylor,2022-10-29,11360,Saturday,1,2022/2023,2023,15,38,11,6,21,37,71,-34,39,0.9181338028169014
14,10/29/2022,17:30,fulham,1.9,0:0,0.9,Everton,23534,craven cottage,John Brooks,2022-10-29,25700,Saturday,1,2022/2023,2023,10,38,15,7,16,55,53,2,52,0.9157198443579767
14,10/29/2022,19:45,liverpool,1.7,1:2,1.8,Leeds United,53274,anfield,Michael Oliver,2022-10-29,53394,Saturday,1,2022/2023,2023,5,38,19,10,9,75,47,28,67,0.9977525564670188
14,10/30/2022,14:00,arsenal,2.3,5:0,0.4,Nott'ham Forest,60263,emirates stadium,Simon Hooper,2022-10-30,59867,Sunday,1,2022/2023,2023,2,38,26,6,6,88,43,45,84,1.0
14,10/30/2022,16:15,manchester utd,1.2,1:0,1.1,West Ham,73682,old trafford,Chris Kavanagh,2022-10-30,74994,Sunday,1,2022/2023,2023,3,38,23,6,9,58,43,15,75,0.9825052670880338
15,11/5/2022,15:00,nottingham forest,1.5,2:2,1.5,Brentford,28869,the city ground,Andre Marriner,2022-11-05,39595,Saturday,1,2022/2023,2023,16,38,9,11,18,38,68,-30,38,0.7291072105063771
15,11/5/2022,15:00,leeds united,2.2,4:3,1.5,Bournemouth,36304,elland road,Tony Harrington,2022-11-05,39460,Saturday,1,2022/2023,2023,19,38,7,10,21,48,78,-30,31,0.9200202736948809
15,11/5/2022,15:00,manchester city,2.1,2:1,1.0,Fulham,52395,etihad stadium,Darren England,2022-11-05,55017,Saturday,1,2022/2023,2023,1,38,28,5,5,94,33,61,89,0.9523420033807732
15,11/5/2022,15:00,wolves,1.2,2:3,1.5,Brighton,30732,molineux stadium,Graham Scott,2022-11-05,32057,Saturday,1,2022/2023,2023,13,38,11,8,19,31,58,-27,41,0.9586673737405247
15,11/5/2022,17:30,everton,1.2,0:2,2.3,Leicester City,39206,goodison park,David Coote,2022-11-05,39595,Saturday,1,2022/2023,2023,17,38,8,12,18,34,57,-23,36,0.9901755272130319
15,11/6/2022,12:00,chelsea,0.3,0:1,2.1,Arsenal,40142,stamford bridge,Michael Oliver,2022-11-06,41631,Sunday,1,2022/2023,2023,12,38,11,11,16,38,47,-9,44,0.9642333837765127
15,11/6/2022,14:00,west ham,0.3,1:2,1.0,Crystal Palace,62451,london stadium,Paul Tierney,2022-11-06,60000,Sunday,1,2022/2023,2023,14,38,11,7,20,42,55,-13,40,1.0
15,11/6/2022,14:00,southampton,1.7,1:4,0.9,Newcastle Utd,30402,st. mary's stadium,Stuart Attwell,2022-11-06,39595,Sunday,1,2022/2023,2023,20,38,6,7,25,36,73,-37,25,0.767824220229827
15,11/6/2022,14:00,aston villa,0.6,3:1,0.5,Manchester Utd,42058,villa park,Anthony Taylor,2022-11-06,42682,Sunday,1,2022/2023,2023,7,38,18,7,13,51,46,5,61,0.9853802539712291
15,11/6/2022,16:30,tottenham,1.2,1:2,1.2,Liverpool,62008,tottenham hotspur stadium,Andy Madley,2022-11-06,32000,Sunday,1,2022/2023,2023,8,38,18,6,14,70,63,7,60,1.0
16,11/12/2022,12:30,manchester city,1.6,1:2,1.3,Brentford,52786,etihad stadium,Peter Bankes,2022-11-12,55017,Saturday,1,2022/2023,2023,1,38,28,5,5,94,33,61,89,0.959448897613465
16,11/12/2022,15:00,tottenham,1.8,4:3,1.1,Leeds United,61667,tottenham hotspur stadium,Michael Salisbury,2022-11-12,32000,Saturday,1,2022/2023,2023,8,38,18,6,14,70,63,7,60,1.0
16,11/12/2022,15:00,liverpool,1.9,3:1,1.1,Southampton,53331,anfield,Simon Hooper,2022-11-12,53394,Saturday,1,2022/2023,2023,5,38,19,10,9,75,47,28,67,0.9988200921451849
16,11/12/2022,15:00,bournemouth,2.4,3:0,0.8,Everton,10382,vitality stadium,Craig Pawson,2022-11-12,11360,Saturday,1,2022/2023,2023,15,38,11,6,21,37,71,-34,39,0.9139084507042253
16,11/12/2022,15:00,west ham,1.4,0:2,1.8,Leicester City,62459,london stadium,Jarred Gillett,2022-11-12,60000,Saturday,1,2022/2023,2023,14,38,11,7,20,42,55,-13,40,1.0
16,11/12/2022,15:00,nottingham forest,1.1,1:0,1.2,Crystal Palace,29045,the city ground,John Brooks,2022-11-12,39595,Saturday,1,2022/2023,2023,16,38,9,11,18,38,68,-30,38,0.7335522161889128
16,11/12/2022,17:30,newcastle utd,1.0,1:0,0.3,Chelsea,52264,st james' park,Robert Jones,2022-11-12,39595,Saturday,1,2022/2023,2023,4,38,19,14,5,68,33,35,71,1.0
16,11/12/2022,19:45,wolves,0.7,0:2,2.1,Arsenal,34624,molineux stadium,Stuart Attwell,2022-11-12,32057,Saturday,1,2022/2023,2023,13,38,11,8,19,31,58,-27,41,1.0
16,11/13/2022,14:00,brighton,0.6,1:2,1.5,Aston Villa,31581,the american express community stadium,Chris Kavanagh,2022-11-13,39595,Sunday,1,2022/2023,2023,6,38,18,8,12,72,53,19,62,0.797600707159995
16,11/13/2022,16:30,fulham,1.4,1:2,2.5,Manchester Utd,24246,craven cottage,Paul Tierney,2022-11-13,25700,Sunday,1,2022/2023,2023,10,38,15,7,16,55,53,2,52,0.9434241245136187
17,12/26/2022,12:30,brentford,2.0,2:2,1.1,Tottenham,17137,brentford community stadium,David Coote,2022-12-26,39595,Monday,0,2022/2023,2023,9,38,15,14,9,58,46,12,59,0.43280717262280594
17,12/26/2022,15:00,southampton,1.9,1:3,0.6,Brighton,31010,st. mary's stadium,Robert Jones,2022-12-26,39595,Monday,0,2022/2023,2023,20,38,6,7,25,36,73,-37,25,0.7831796944058593
17,12/26/2022,15:00,leicester city,0.5,0:3,1.9,Newcastle Utd,32185,king power stadium,Jarred Gillett,2022-12-26,32273,Monday,0,2022/2023,2023,18,38,9,7,22,51,68,-17,34,0.997273262479472
17,12/26/2022,15:00,crystal palace,0.4,0:3,2.5,Fulham,25176,selhurst park,Andy Madley,2022-12-26,25456,Monday,0,2022/2023,2023,11,38,11,12,15,40,49,-9,45,0.9890006285355123
17,12/26/2022,15:00,everton,1.7,1:2,0.8,Wolves,39252,goodison park,Craig Pawson,2022-12-26,39595,Monday,0,2022/2023,2023,17,38,8,12,18,34,57,-23,36,0.9913372900618765
17,12/26/2022,17:30,aston villa,1.4,1:3,2.7,Liverpool,42085,villa park,Paul Tierney,2022-12-26,42682,Monday,0,2022/2023,2023,7,38,18,7,13,51,46,5,61,0.9860128391359355
17,12/26/2022,20:00,arsenal,2.1,3:1,1.0,West Ham,60125,emirates stadium,Michael Oliver,2022-12-26,59867,Monday,0,2022/2023,2023,2,38,26,6,6,88,43,45,84,1.0
17,12/27/2022,17:30,chelsea,1.8,2:0,0.5,Bournemouth,40046,stamford bridge,Simon Hooper,2022-12-27,41631,Tuesday,0,2022/2023,2023,12,38,11,11,16,38,47,-9,44,0.9619274098628426
17,12/27/2022,20:00,manchester utd,2.4,3:0,0.7,Nott'ham Forest,73608,old trafford,Anthony Taylor,2022-12-27,74994,Tuesday,0,2022/2023,2023,3,38,23,6,9,58,43,15,75,0.9815185214817186
17,12/28/2022,20:00,leeds united,0.6,1:3,4.3,Manchester City,36889,elland road,Stuart Attwell,2022-12-28,39460,Wednesday,0,2022/2023,2023,19,38,7,10,21,48,78,-30,31,0.9348454130765332
18,12/30/2022,19:45,west ham,1.3,0:2,1.6,Brentford,62467,london stadium,Darren England,2022-12-30,60000,Friday,0,2022/2023,2023,14,38,11,7,20,42,55,-13,40,1.0
18,12/30/2022,20:00,liverpool,2.2,2:1,1.0,Leicester City,53343,anfield,Craig Pawson,2022-12-30,53394,Friday,0,2022/2023,2023,5,38,19,10,9,75,47,28,67,0.999044836498483
18,12/31/2022,12:30,wolves,0.7,0:1,2.0,Manchester Utd,31658,molineux stadium,Robert Jones,2022-12-31,32057,Saturday,1,2022/2023,2023,13,38,11,8,19,31,58,-27,41,0.9875534204697882
18,12/31/2022,15:00,newcastle utd,2.2,0:0,0.4,Leeds United,52211,st james' park,Simon Hooper,2022-12-31,39595,Saturday,1,2022/2023,2023,4,38,19,14,5,68,33,35,71,1.0
18,12/31/2022,15:00,fulham,1.5,2:1,0.8,Southampton,24344,craven cottage,Graham Scott,2022-12-31,25700,Saturday,1,2022/2023,2023,10,38,15,7,16,55,53,2,52,0.9472373540856032
18,12/31/2022,15:00,manchester city,1.7,1:1,0.1,Everton,53444,etihad stadium,Andy Madley,2022-12-31,55017,Saturday,1,2022/2023,2023,1,38,28,5,5,94,33,61,89,0.9714088372684806
18,12/31/2022,15:00,bournemouth,0.6,0:2,1.6,Crystal Palace,9972,vitality stadium,Andre Marriner,2022-12-31,11360,Saturday,1,2022/2023,2023,15,38,11,6,21,37,71,-34,39,0.8778169014084507
18,12/31/2022,17:30,brighton,1.2,2:4,2.9,Arsenal,31647,the american express community stadium,Anthony Taylor,2022-12-31,39595,Saturday,1,2022/2023,2023,6,38,18,8,12,72,53,19,62,0.7992675842909458
18,1/1/2023,14:00,tottenham,0.7,0:2,1.0,Aston Villa,61651,tottenham hotspur stadium,John Brooks,2023-01-01,32000,Sunday,1,2022/2023,2023,8,38,18,6,14,70,63,7,60,1.0
18,1/1/2023,16:30,nottingham forest,1.4,1:1,0.9,Chelsea,29229,the city ground,Peter Bankes,2023-01-01,39595,Sunday,1,2022/2023,2023,16,38,9,11,18,38,68,-30,38,0.738199267584291
19,1/2/2023,17:30,brentford,1.7,3:1,2.0,Liverpool,17163,brentford community stadium,Stuart Attwell,2023-01-02,39595,Monday,0,2022/2023,2023,9,38,15,14,9,58,46,12,59,0.43346382118954413
19,1/3/2023,19:45,leicester city,1.7,0:1,1.7,Fulham,30813,king power stadium,Darren Bond,2023-01-03,32273,Tuesday,0,2022/2023,2023,18,38,9,7,22,51,68,-17,34,0.9547609456821492
19,1/3/2023,19:45,everton,1.3,1:4,2.2,Brighton,39103,goodison park,Andre Marriner,2023-01-03,39595,Tuesday,0,2022/2023,2023,17,38,8,12,18,34,57,-23,36,0.9875741886601843
19,1/3/2023,19:45,arsenal,1.1,0:0,1.0,Newcastle Utd,60319,emirates stadium,Andy Madley,2023-01-03,59867,Tuesday,0,2022/2023,2023,2,38,26,6,6,88,43,45,84,1.0
19,1/3/2023,20:00,manchester utd,2.2,3:0,0.6,Bournemouth,73322,old trafford,Michael Salisbury,2023-01-03,74994,Tuesday,0,2022/2023,2023,3,38,23,6,9,58,43,15,75,0.9777048830573113
19,1/4/2023,19:30,southampton,0.5,0:1,1.4,Nott'ham Forest,30150,st. mary's stadium,Thomas Bramall,2023-01-04,39595,Wednesday,0,2022/2023,2023,20,38,6,7,25,36,73,-37,25,0.7614597802752873
19,1/4/2023,19:45,leeds united,1.6,2:2,1.4,West Ham,36173,elland road,David Coote,2023-01-04,39460,Wednesday,0,2022/2023,2023,19,38,7,10,21,48,78,-30,31,0.9167004561581348
19,1/4/2023,20:00,aston villa,1.8,1:1,0.9,Wolves,39978,villa park,Jarred Gillett,2023-01-04,42682,Wednesday,0,2022/2023,2023,7,38,18,7,13,51,46,5,61,0.9366477672086594
19,1/4/2023,20:00,crystal palace,0.8,0:4,1.4,Tottenham,25132,selhurst park,Michael Oliver,2023-01-04,25456,Wednesday,0,2022/2023,2023,11,38,11,12,15,40,49,-9,45,0.9872721558768071
19,1/5/2023,20:00,chelsea,0.4,0:1,2.1,Manchester City,39998,stamford bridge,Paul Tierney,2023-01-05,41631,Thursday,0,2022/2023,2023,12,38,11,11,16,38,47,-9,44,0.9607744229060076
7,1/12/2023,20:00,fulham,1.0,2:1,2.1,Chelsea,24460,craven cottage,David Coote,2023-01-12,25700,Thursday,0,2022/2023,2023,10,38,15,7,16,55,53,2,52,0.9517509727626459
20,1/13/2023,20:00,aston villa,1.2,2:1,2.4,Leeds United,42008,villa park,Michael Oliver,2023-01-13,42682,Friday,0,2022/2023,2023,7,38,18,7,13,51,46,5,61,0.9842087999625134
20,1/14/2023,12:30,manchester utd,1.7,2:1,0.6,Manchester City,75546,old trafford,Stuart Attwell,2023-01-14,74994,Saturday,1,2022/2023,2023,3,38,23,6,9,58,43,15,75,1.0
20,1/14/2023,15:00,everton,1.4,1:2,1.2,Southampton,39305,goodison park,John Brooks,2023-01-14,39595,Saturday,1,2022/2023,2023,17,38,8,12,18,34,57,-23,36,0.9926758429094583
20,1/14/2023,15:00,wolves,0.9,1:0,1.1,West Ham,31511,molineux stadium,Simon Hooper,2023-01-14,32057,Saturday,1,2022/2023,2023,13,38,11,8,19,31,58,-27,41,0.9829678385376049
20,1/14/2023,15:00,nottingham forest,2.4,2:0,1.0,Leicester City,29301,the city ground,Paul Tierney,2023-01-14,39595,Saturday,1,2022/2023,2023,16,38,9,11,18,38,68,-30,38,0.7400176789998737
20,1/14/2023,15:00,brighton,1.9,3:0,1.0,Liverpool,31645,the american express community stadium,Darren England,2023-01-14,39595,Saturday,1,2022/2023,2023,6,38,18,8,12,72,53,19,62,0.7992170728627352
20,1/14/2023,17:30,brentford,1.4,2:0,0.6,Bournemouth,17031,brentford community stadium,Jarred Gillett,2023-01-14,39595,Saturday,1,2022/2023,2023,9,38,15,14,9,58,46,12,59,0.4301300669276424
20,1/15/2023,14:00,chelsea,1.5,1:0,0.7,Crystal Palace,40075,stamford bridge,Peter Bankes,2023-01-15,41631,Sunday,1,2022/2023,2023,12,38,11,11,16,38,47,-9,44,0.9626240061492638
20,1/15/2023,14:00,newcastle utd,2.2,1:0,1.1,Fulham,52247,st james' park,Robert Jones,2023-01-15,39595,Sunday,1,2022/2023,2023,4,38,19,14,5,68,33,35,71,1.0
20,1/15/2023,16:30,tottenham,1.6,0:2,1.8,Arsenal,61870,tottenham hotspur stadium,Craig Pawson,2023-01-15,32000,Sunday,1,2022/2023,2023,8,38,18,6,14,70,63,7,60,1.0
7,1/18/2023,20:00,crystal palace,0.5,1:1,2.1,Manchester Utd,23343,selhurst park,Robert Jones,2023-01-18,25456,Wednesday,0,2022/2023,2023,11,38,11,12,15,40,49,-9,45,0.9169940289126336
7,1/19/2023,20:00,manchester city,2.3,4:2,0.8,Tottenham,53088,etihad stadium,Simon Hooper,2023-01-19,55017,Thursday,0,2022/2023,2023,1,38,28,5,5,94,33,61,89,0.9649381100387153
21,1/21/2023,12:30,liverpool,1.4,0:0,1.6,Chelsea,53126,anfield,Michael Oliver,2023-01-21,53394,Saturday,1,2022/2023,2023,5,38,19,10,9,75,47,28,67,0.9949807094430085
21,1/21/2023,15:00,bournemouth,1.4,1:1,1.9,Nott'ham Forest,10248,vitality stadium,Andy Madley,2023-01-21,11360,Saturday,1,2022/2023,2023,15,38,11,6,21,37,71,-34,39,0.902112676056338
21,1/21/2023,15:00,southampton,0.6,0:1,1.4,Aston Villa,30158,st. mary's stadium,Michael Salisbury,2023-01-21,39595,Saturday,1,2022/2023,2023,20,38,6,7,25,36,73,-37,25,0.7616618259881298
21,1/21/2023,15:00,leicester city,0.9,2:2,1.7,Brighton,32056,king power stadium,Thomas Bramall,2023-01-21,32273,Saturday,1,2022/2023,2023,18,38,9,7,22,51,68,-17,34,0.9932761131596071
21,1/21/2023,15:00,west ham,2.2,2:0,0.5,Everton,62470,london stadium,Stuart Attwell,2023-01-21,60000,Saturday,1,2022/2023,2023,14,38,11,7,20,42,55,-13,40,1.0
21,1/21/2023,17:30,crystal palace,0.3,0:0,1.2,Newcastle Utd,25350,selhurst park,Craig Pawson,2023-01-21,25456,Saturday,1,2022/2023,2023,11,38,11,12,15,40,49,-9,45,0.9958359522313011
21,1/22/2023,14:00,manchester city,2.8,3:0,0.8,Wolves,53282,etihad stadium,David Coote,2023-01-22,55017,Sunday,1,2022/2023,2023,1,38,28,5,5,94,33,61,89,0.9684642928549357
21,1/22/2023,14:00,leeds united,0.5,0:0,0.4,Brentford,36260,elland road,Peter Bankes,2023-01-22,39460,Sunday,1,2022/2023,2023,19,38,7,10,21,48,78,-30,31,0.9189052204764319
21,1/22/2023,16:30,arsenal,3.1,3:2,0.4,Manchester Utd,60325,emirates stadium,Anthony Taylor,2023-01-22,59867,Sunday,1,2022/2023,2023,2,38,26,6,6,88,43,45,84,1.0
21,1/23/2023,20:00,fulham,1.0,0:1,0.9,Tottenham,24190,craven cottage,Paul Tierney,2023-01-23,25700,Monday,0,2022/2023,2023,10,38,15,7,16,55,53,2,52,0.9412451361867704
22,2/3/2023,20:00,chelsea,1.3,0:0,0.6,Fulham,40041,stamford bridge,Stuart Attwell,2023-02-03,41631,Friday,0,2022/2023,2023,12,38,11,11,16,38,47,-9,44,0.961807307054839
22,2/4/2023,12:30,everton,1.7,1:0,0.9,Arsenal,39314,goodison park,David Coote,2023-02-04,39595,Saturday,1,2022/2023,2023,17,38,8,12,18,34,57,-23,36,0.9929031443364061
22,2/4/2023,15:00,aston villa,1.7,2:4,2.6,Leicester City,42055,villa park,Darren England,2023-02-04,42682,Saturday,1,2022/2023,2023,7,38,18,7,13,51,46,5,61,0.9853099667307061
22,2/4/2023,15:00,wolves,2.0,3:0,1.8,Liverpool,31664,molineux stadium,Paul Tierney,2023-02-04,32057,Saturday,1,2022/2023,2023,13,38,11,8,19,31,58,-27,41,0.987740587079265
22,2/4/2023,15:00,manchester utd,2.0,2:1,1.3,Crystal Palace,73420,old trafford,Andre Marriner,2023-02-04,74994,Saturday,1,2022/2023,2023,3,38,23,6,9,58,43,15,75,0.9790116542656746
22,2/4/2023,15:00,brighton,2.2,1:0,1.1,Bournemouth,31600,the american express community stadium,Craig Pawson,2023-02-04,39595,Saturday,1,2022/2023,2023,6,38,18,8,12,72,53,19,62,0.7980805657279959
22,2/4/2023,15:00,brentford,2.2,3:0,0.7,Southampton,17051,brentford community stadium,Darren Bond,2023-02-04,39595,Saturday,1,2022/2023,2023,9,38,15,14,9,58,46,12,59,0.4306351812097487
22,2/4/2023,17:30,newcastle utd,1.0,1:1,1.0,West Ham,52256,st james' park,Peter Bankes,2023-02-04,39595,Saturday,1,2022/2023,2023,4,38,19,14,5,68,33,35,71,1.0
22,2/5/2023,14:00,nottingham forest,0.4,1:0,0.9,Leeds United,29363,the city ground,Robert Jones,2023-02-05,39595,Sunday,1,2022/2023,2023,16,38,9,11,18,38,68,-30,38,0.7415835332744033
22,2/5/2023,16:30,tottenham,1.4,1:0,1.3,Manchester City,61747,tottenham hotspur stadium,Andy Madley,2023-02-05,32000,Sunday,1,2022/2023,2023,8,38,18,6,14,70,63,7,60,1.0
8,2/8/2023,20:00,manchester utd,2.0,2:2,0.6,Leeds United,73456,old trafford,Simon Hooper,2023-02-08,74994,Wednesday,0,2022/2023,2023,3,38,23,6,9,58,43,15,75,0.9794916926687468
23,2/11/2023,12:30,west ham,1.3,1:1,1.1,Chelsea,62471,london stadium,Craig Pawson,2023-02-11,60000,Saturday,1,2022/2023,2023,14,38,11,7,20,42,55,-13,40,1.0
23,2/11/2023,15:00,leicester city,1.7,4:1,1.3,Tottenham,32184,king power stadium,Michael Salisbury,2023-02-11,32273,Saturday,1,2022/2023,2023,18,38,9,7,22,51,68,-17,34,0.9972422768258297
23,2/11/2023,15:00,crystal palace,1.1,1:1,2.5,Brighton,24827,selhurst park,Michael Oliver,2023-02-11,25456,Saturday,1,2022/2023,2023,11,38,11,12,15,40,49,-9,45,0.9752906976744186
23,2/11/2023,15:00,arsenal,1.6,1:1,2.0,Brentford,60254,emirates stadium,Peter Bankes,2023-02-11,59867,Saturday,1,2022/2023,2023,2,38,26,6,6,88,43,45,84,1.0
23,2/11/2023,15:00,southampton,1.1,1:2,0.8,Wolves,29751,st. mary's stadium,Jarred Gillett,2023-02-11,39595,Saturday,1,2022/2023,2023,20,38,6,7,25,36,73,-37,25,0.7513827503472661
23,2/11/2023,15:00,fulham,1.5,2:0,0.7,Nott'ham Forest,24244,craven cottage,Andy Madley,2023-02-11,25700,Saturday,1,2022/2023,2023,10,38,15,7,16,55,53,2,52,0.9433463035019455
23,2/11/2023,17:30,bournemouth,1.5,1:1,1.3,Newcastle Utd,10419,vitality stadium,Stuart Attwell,2023-02-11,11360,Saturday,1,2022/2023,2023,15,38,11,6,21,37,71,-34,39,0.9171654929577465
23,2/12/2023,14:00,leeds united,1.8,0:2,1.1,Manchester Utd,36919,elland road,Paul Tierney,2023-02-12,39460,Sunday,1,2022/2023,2023,19,38,7,10,21,48,78,-30,31,0.9356056766345666
23,2/12/2023,16:30,manchester city,3.3,3:1,0.3,Aston Villa,53392,etihad stadium,Robert Jones,2023-02-12,55017,Sunday,1,2022/2023,2023,1,38,28,5,5,94,33,61,89,0.9704636748641329
23,2/13/2023,20:00,liverpool,2.3,2:0,0.4,Everton,53027,anfield,Simon Hooper,2023-02-13,53394,Monday,0,2022/2023,2023,5,38,19,10,9,75,47,28,67,0.9931265685282991
12,2/15/2023,19:30,arsenal,1.6,1:3,1.8,Manchester City,60276,emirates stadium,Anthony Taylor,2023-02-15,59867,Wednesday,0,2022/2023,2023,2,38,26,6,6,88,43,45,84,1.0
24,2/18/2023,12:30,aston villa,0.5,2:4,3.2,Arsenal,42066,villa park,Simon Hooper,2023-02-18,42682,Saturday,1,2022/2023,2023,7,38,18,7,13,51,46,5,61,0.9855676866126236
24,2/18/2023,15:00,brighton,2.2,0:1,0.3,Fulham,31619,the american express community stadium,Darren England,2023-02-18,39595,Saturday,1,2022/2023,2023,6,38,18,8,12,72,53,19,62,0.7985604242959969
24,2/18/2023,15:00,nottingham forest,0.9,1:1,2.4,Manchester City,29365,the city ground,Graham Scott,2023-02-18,39595,Saturday,1,2022/2023,2023,16,38,9,11,18,38,68,-30,38,0.741634044702614
24,2/18/2023,15:00,chelsea,1.6,0:1,0.6,Southampton,40152,stamford bridge,David Coote,2023-02-18,41631,Saturday,1,2022/2023,2023,12,38,11,11,16,38,47,-9,44,0.96447358939252
24,2/18/2023,15:00,everton,1.4,1:0,0.5,Leeds United,39232,goodison park,Andy Madley,2023-02-18,39595,Saturday,1,2022/2023,2023,17,38,8,12,18,34,57,-23,36,0.9908321757797701
24,2/18/2023,15:00,wolves,1.3,0:1,1.1,Bournemouth,31222,molineux stadium,Michael Salisbury,2023-02-18,32057,Saturday,1,2022/2023,2023,13,38,11,8,19,31,58,-27,41,0.9739526468478024
24,2/18/2023,15:00,brentford,0.9,1:1,1.1,Crystal Palace,17122,brentford community stadium,Paul Tierney,2023-02-18,39595,Saturday,1,2022/2023,2023,9,38,15,14,9,58,46,12,59,0.4324283369112262
24,2/18/2023,17:30,newcastle utd,2.0,0:2,1.9,Liverpool,52758,st james' park,Anthony Taylor,2023-02-18,39595,Saturday,1,2022/2023,2023,4,38,19,14,5,68,33,35,71,1.0
24,2/19/2023,14:00,manchester utd,4.4,3:0,1.6,Leicester City,73578,old trafford,Stuart Attwell,2023-02-19,74994,Sunday,1,2022/2023,2023,3,38,23,6,9,58,43,15,75,0.9811184894791584
24,2/19/2023,16:30,tottenham,1.5,2:0,0.5,West Ham,61476,tottenham hotspur stadium,Michael Oliver,2023-02-19,32000,Sunday,1,2022/2023,2023,8,38,18,6,14,70,63,7,60,1.0
25,2/24/2023,20:00,fulham,0.5,1:1,0.8,Wolves,24399,craven cottage,Michael Oliver,2023-02-24,25700,Friday,0,2022/2023,2023,10,38,15,7,16,55,53,2,52,0.9493774319066148
25,2/25/2023,15:00,leicester city,0.0,0:1,0.7,Arsenal,32227,king power stadium,Craig Pawson,2023-02-25,32273,Saturday,1,2022/2023,2023,18,38,9,7,22,51,68,-17,34,0.9985746599324513
25,2/25/2023,15:00,everton,1.6,0:2,1.9,Aston Villa,39309,goodison park,Anthony Taylor,2023-02-25,39595,Saturday,1,2022/2023,2023,17,38,8,12,18,34,57,-23,36,0.9927768657658795
25,2/25/2023,15:00,west ham,2.7,4:0,0.4,Nott'ham Forest,62469,london stadium,Jarred Gillett,2023-02-25,60000,Saturday,1,2022/2023,2023,14,38,11,7,20,42,55,-13,40,1.0
25,2/25/2023,15:00,leeds united,0.9,1:0,0.4,Southampton,36641,elland road,Peter Bankes,2023-02-25,39460,Saturday,1,2022/2023,2023,19,38,7,10,21,48,78,-30,31,0.9285605676634566
25,2/25/2023,17:30,bournemouth,1.0,1:4,2.4,Manchester City,10481,vitality stadium,Paul Tierney,2023-02-25,11360,Saturday,1,2022/2023,2023,15,38,11,6,21,37,71,-34,39,0.9226232394366197
25,2/25/2023,19:45,crystal palace,0.7,0:0,0.9,Liverpool,25842,selhurst park,Darren England,2023-02-25,25456,Saturday,1,2022/2023,2023,11,38,11,12,15,40,49,-9,45,1.0
25,2/26/2023,13:30,tottenham,0.8,2:0,0.4,Chelsea,61613,tottenham hotspur stadium,Stuart Attwell,2023-02-26,32000,Sunday,1,2022/2023,2023,8,38,18,6,14,70,63,7,60,1.0
7,3/1/2023,19:45,arsenal,2.6,4:0,1.2,Everton,60213,emirates stadium,Michael Oliver,2023-03-01,59867,Wednesday,0,2022/2023,2023,2,38,26,6,6,88,43,45,84,1.0
7,3/1/2023,20:00,liverpool,2.6,2:0,0.8,Wolves,53259,anfield,Paul Tierney,2023-03-01,53394,Wednesday,0,2022/2023,2023,5,38,19,10,9,75,47,28,67,0.9974716260253961
26,3/4/2023,12:30,manchester city,1.3,2:0,0.4,Newcastle Utd,53419,etihad stadium,Simon Hooper,2023-03-04,55017,Saturday,1,2022/2023,2023,1,38,28,5,5,94,33,61,89,0.9709544322663904
26,3/4/2023,15:00,arsenal,2.1,3:2,1.3,Bournemouth,60222,emirates stadium,Chris Kavanagh,2023-03-04,59867,Saturday,1,2022/2023,2023,2,38,26,6,6,88,43,45,84,1.0
26,3/4/2023,15:00,aston villa,1.2,1:0,0.2,Crystal Palace,41893,villa park,Craig Pawson,2023-03-04,42682,Saturday,1,2022/2023,2023,7,38,18,7,13,51,46,5,61,0.9815144557424675
26,3/4/2023,15:00,chelsea,1.5,1:0,1.0,Leeds United,39905,stamford bridge,Michael Oliver,2023-03-04,41631,Saturday,1,2022/2023,2023,12,38,11,11,16,38,47,-9,44,0.9585405106771396
26,3/4/2023,15:00,brighton,3.5,4:0,0.3,West Ham,31523,the american express community stadium,Stuart Attwell,2023-03-04,39595,Saturday,1,2022/2023,2023,6,38,18,8,12,72,53,19,62,0.7961358757418866
26,3/4/2023,15:00,wolves,0.5,1:0,1.2,Tottenham,31585,molineux stadium,Tim Robinson,2023-03-04,32057,Saturday,1,2022/2023,2023,13,38,11,8,19,31,58,-27,41,0.9852762267211529
26,3/4/2023,17:30,southampton,1.4,1:0,1.9,Leicester City,30139,st. mary's stadium,Robert Jones,2023-03-04,39595,Saturday,1,2022/2023,2023,20,38,6,7,25,36,73,-37,25,0.7611819674201288
26,3/5/2023,14:00,nottingham forest,0.8,2:2,1.7,Everton,29353,the city ground,John Brooks,2023-03-05,39595,Sunday,1,2022/2023,2023,16,38,9,11,18,38,68,-30,38,0.7413309761333502
26,3/5/2023,16:30,liverpool,2.8,7:0,0.8,Manchester Utd,53001,anfield,Andy Madley,2023-03-05,53394,Sunday,1,2022/2023,2023,5,38,19,10,9,75,47,28,67,0.9926396224294864
26,3/6/2023,20:00,brentford,2.2,3:2,1.4,Fulham,17025,brentford community stadium,Anthony Taylor,2023-03-06,39595,Monday,0,2022/2023,2023,9,38,15,14,9,58,46,12,59,0.4299785326430105
27,3/11/2023,12:30,bournemouth,0.9,1:0,1.7,Liverpool,10536,vitality stadium,John Brooks,2023-03-11,11360,Saturday,1,2022/2023,2023,15,38,11,6,21,37,71,-34,39,0.9274647887323944
27,3/11/2023,15:00,leeds united,0.9,2:2,2.7,Brighton,36471,elland road,Paul Tierney,2023-03-11,39460,Saturday,1,2022/2023,2023,19,38,7,10,21,48,78,-30,31,0.9242524075012671
27,3/11/2023,15:00,everton,1.0,1:0,2.0,Brentford,39274,goodison park,Simon Hooper,2023-03-11,39595,Saturday,1,2022/2023,2023,17,38,8,12,18,34,57,-23,36,0.9918929157721934
27,3/11/2023,15:00,leicester city,2.4,1:3,1.6,Chelsea,32170,king power stadium,Andre Marriner,2023-03-11,32273,Saturday,1,2022/2023,2023,18,38,9,7,22,51,68,-17,34,0.9968084776748366
27,3/11/2023,15:00,tottenham,2.0,3:1,1.5,Nott'ham Forest,61460,tottenham hotspur stadium,Craig Pawson,2023-03-11,32000,Saturday,1,2022/2023,2023,8,38,18,6,14,70,63,7,60,1.0
27,3/11/2023,17:30,crystal palace,0.2,0:1,2.1,Manchester City,25844,selhurst park,Robert Jones,2023-03-11,25456,Saturday,1,2022/2023,2023,11,38,11,12,15,40,49,-9,45,1.0
27,3/12/2023,14:00,manchester utd,0.8,0:0,1.0,Southampton,73439,old trafford,Anthony Taylor,2023-03-12,74994,Sunday,1,2022/2023,2023,3,38,23,6,9,58,43,15,75,0.9792650078672961
27,3/12/2023,14:00,fulham,0.8,0:3,2.3,Arsenal,24426,craven cottage,David Coote,2023-03-12,25700,Sunday,1,2022/2023,2023,10,38,15,7,16,55,53,2,52,0.9504280155642023
27,3/12/2023,14:00,west ham,2.1,1:1,1.5,Aston Villa,62472,london stadium,Chris Kavanagh,2023-03-12,60000,Sunday,1,2022/2023,2023,14,38,11,7,20,42,55,-13,40,1.0
27,3/12/2023,16:30,newcastle utd,1.8,2:1,1.1,Wolves,52240,st james' park,Andy Madley,2023-03-12,39595,Sunday,1,2022/2023,2023,4,38,19,14,5,68,33,35,71,1.0
7,3/15/2023,19:30,southampton,0.5,0:2,1.9,Brentford,30438,st. mary's stadium,Michael Salisbury,2023-03-15,39595,Wednesday,0,2022/2023,2023,20,38,6,7,25,36,73,-37,25,0.7687334259376184
8,3/15/2023,19:30,brighton,0.6,1:0,1.1,Crystal Palace,30933,the american express community stadium,Peter Bankes,2023-03-15,39595,Wednesday,0,2022/2023,2023,6,38,18,8,12,72,53,19,62,0.78123500441975
28,3/17/2023,20:00,nottingham forest,0.4,1:2,2.4,Newcastle Utd,29362,the city ground,Paul Tierney,2023-03-17,39595,Friday,0,2022/2023,2023,16,38,9,11,18,38,68,-30,38,0.741558277560298
28,3/18/2023,15:00,wolves,2.7,2:4,1.6,Leeds United,31570,molineux stadium,Michael Salisbury,2023-03-18,32057,Saturday,1,2022/2023,2023,13,38,11,8,19,31,58,-27,41,0.9848083101974607
28,3/18/2023,15:00,brentford,0.6,1:1,1.3,Leicester City,17006,brentford community stadium,Darren Bond,2023-03-18,39595,Saturday,1,2022/2023,2023,9,38,15,14,9,58,46,12,59,0.42949867407500947
28,3/18/2023,15:00,aston villa,3.5,3:0,1.3,Bournemouth,41021,villa park,Robert Jones,2023-03-18,42682,Saturday,1,2022/2023,2023,7,38,18,7,13,51,46,5,61,0.9610842978304672
28,3/18/2023,15:00,southampton,2.4,3:3,2.3,Tottenham,30157,st. mary's stadium,Simon Hooper,2023-03-18,39595,Saturday,1,2022/2023,2023,20,38,6,7,25,36,73,-37,25,0.7616365702740245
28,3/18/2023,17:30,chelsea,2.3,2:2,1.2,Everton,40025,stamford bridge,Darren England,2023-03-18,41631,Saturday,1,2022/2023,2023,12,38,11,11,16,38,47,-9,44,0.9614229780692273
28,3/19/2023,14:00,arsenal,1.6,4:1,0.8,Crystal Palace,60247,emirates stadium,Stuart Attwell,2023-03-19,59867,Sunday,1,2022/2023,2023,2,38,26,6,6,88,43,45,84,1.0
29,4/1/2023,12:30,manchester city,2.9,4:1,0.3,Liverpool,52877,etihad stadium,Simon Hooper,2023-04-01,55017,Saturday,1,2022/2023,2023,1,38,28,5,5,94,33,61,89,0.9611029318210735
29,4/1/2023,15:00,arsenal,3.8,4:1,0.7,Leeds United,60283,emirates stadium,Darren England,2023-04-01,59867,Saturday,1,2022/2023,2023,2,38,26,6,6,88,43,45,84,1.0
29,4/1/2023,15:00,nottingham forest,1.3,1:1,0.5,Wolves,29368,the city ground,Chris Kavanagh,2023-04-01,39595,Saturday,1,2022/2023,2023,16,38,9,11,18,38,68,-30,38,0.7417098118449299
29,4/1/2023,15:00,brighton,4.2,3:3,1.6,Brentford,31493,the american express community stadium,Michael Oliver,2023-04-01,39595,Saturday,1,2022/2023,2023,6,38,18,8,12,72,53,19,62,0.7953782043187271
29,4/1/2023,15:00,crystal palace,2.3,2:1,0.2,Leicester City,25147,selhurst park,Tim Robinson,2023-04-01,25456,Saturday,1,2022/2023,2023,11,38,11,12,15,40,49,-9,45,0.9878614079195475
29,4/1/2023,15:00,bournemouth,2.6,2:1,0.8,Fulham,10305,vitality stadium,Peter Bankes,2023-04-01,11360,Saturday,1,2022/2023,2023,15,38,11,6,21,37,71,-34,39,0.9071302816901409
29,4/1/2023,17:30,chelsea,2.1,0:2,0.9,Aston Villa,40082,stamford bridge,Andy Madley,2023-04-01,41631,Saturday,1,2022/2023,2023,12,38,11,11,16,38,47,-9,44,0.9627921500804689
29,4/2/2023,14:00,west ham,1.4,1:0,0.3,Southampton,62498,london stadium,Paul Tierney,2023-04-02,60000,Sunday,1,2022/2023,2023,14,38,11,7,20,42,55,-13,40,1.0
29,4/2/2023,16:30,newcastle utd,3.7,2:0,0.4,Manchester Utd,52268,st james' park,Stuart Attwell,2023-04-02,39595,Sunday,1,2022/2023,2023,4,38,19,14,5,68,33,35,71,1.0
29,4/3/2023,20:00,everton,0.9,1:1,1.4,Tottenham,39294,goodison park,David Coote,2023-04-03,39595,Monday,0,2022/2023,2023,17,38,8,12,18,34,57,-23,36,0.9923980300542998
7,4/4/2023,19:45,leeds united,1.8,2:1,0.8,Nott'ham Forest,36740,elland road,Robert Jones,2023-04-04,39460,Tuesday,0,2022/2023,2023,19,38,7,10,21,48,78,-30,31,0.9310694374049671
7,4/4/2023,19:45,bournemouth,1.7,0:2,2.7,Brighton,10266,vitality stadium,Darren Bond,2023-04-04,11360,Tuesday,0,2022/2023,2023,15,38,11,6,21,37,71,-34,39,0.9036971830985916
7,4/4/2023,19:45,leicester city,0.5,1:2,1.0,Aston Villa,32087,king power stadium,Graham Scott,2023-04-04,32273,Tuesday,0,2022/2023,2023,18,38,9,7,22,51,68,-17,34,0.9942366684225203
8,4/4/2023,20:00,chelsea,2.2,0:0,0.3,Liverpool,40093,stamford bridge,Anthony Taylor,2023-04-04,41631,Tuesday,0,2022/2023,2023,12,38,11,11,16,38,47,-9,44,0.9630563762580769
7,4/5/2023,20:00,west ham,1.0,1:5,3.3,Newcastle Utd,62481,london stadium,Craig Pawson,2023-04-05,60000,Wednesday,0,2022/2023,2023,14,38,11,7,20,42,55,-13,40,1.0
25,4/5/2023,20:00,manchester utd,1.2,1:0,0.7,Brentford,73309,old trafford,John Brooks,2023-04-05,74994,Wednesday,0,2022/2023,2023,3,38,23,6,9,58,43,15,75,0.9775315358562018
30,4/8/2023,12:30,manchester utd,3.4,2:0,1.0,Everton,73509,old trafford,Michael Oliver,2023-04-08,74994,Saturday,1,2022/2023,2023,3,38,23,6,9,58,43,15,75,0.9801984158732698
30,4/8/2023,15:00,fulham,0.7,0:1,1.1,West Ham,24491,craven cottage,Jarred Gillett,2023-04-08,25700,Saturday,1,2022/2023,2023,10,38,15,7,16,55,53,2,52,0.9529571984435797
30,4/8/2023,15:00,aston villa,1.3,2:0,0.2,Nott'ham Forest,42076,villa park,Anthony Taylor,2023-04-08,42682,Saturday,1,2022/2023,2023,7,38,18,7,13,51,46,5,61,0.9858019774143667
30,4/8/2023,15:00,leicester city,0.7,0:1,2.0,Bournemouth,32094,king power stadium,David Coote,2023-04-08,32273,Saturday,1,2022/2023,2023,18,38,9,7,22,51,68,-17,34,0.9944535679980169
30,4/8/2023,15:00,brentford,2.6,1:2,1.3,Newcastle Utd,17107,brentford community stadium,Chris Kavanagh,2023-04-08,39595,Saturday,1,2022/2023,2023,9,38,15,14,9,58,46,12,59,0.4320495011996464
30,4/8/2023,15:00,wolves,0.6,1:0,1.1,Chelsea,31614,molineux stadium,Peter Bankes,2023-04-08,32057,Saturday,1,2022/2023,2023,13,38,11,8,19,31,58,-27,41,0.9861808653336245
30,4/8/2023,15:00,tottenham,0.8,2:1,1.4,Brighton,61405,tottenham hotspur stadium,Stuart Attwell,2023-04-08,32000,Saturday,1,2022/2023,2023,8,38,18,6,14,70,63,7,60,1.0
30,4/8/2023,17:30,southampton,0.4,1:4,2.9,Manchester City,30963,st. mary's stadium,Robert Jones,2023-04-08,39595,Saturday,1,2022/2023,2023,20,38,6,7,25,36,73,-37,25,0.7819926758429094
30,4/9/2023,14:00,leeds united,0.9,1:5,3.0,Crystal Palace,36427,elland road,Simon Hooper,2023-04-09,39460,Sunday,1,2022/2023,2023,19,38,7,10,21,48,78,-30,31,0.9231373542828181
30,4/9/2023,16:30,liverpool,3.9,2:2,1.4,Arsenal,53267,anfield,Paul Tierney,2023-04-09,53394,Sunday,1,2022/2023,2023,5,38,19,10,9,75,47,28,67,0.9976214555942615
31,4/15/2023,12:30,aston villa,1.9,3:0,0.5,Newcastle Utd,42055,villa park,John Brooks,2023-04-15,42682,Saturday,1,2022/2023,2023,7,38,18,7,13,51,46,5,61,0.9853099667307061
31,4/15/2023,15:00,chelsea,0.5,1:2,2.9,Brighton,40126,stamford bridge,Robert Jones,2023-04-15,41631,Saturday,1,2022/2023,2023,12,38,11,11,16,38,47,-9,44,0.963849054790901
31,4/15/2023,15:00,southampton,0.8,0:2,0.9,Crystal Palace,30309,st. mary's stadium,Michael Oliver,2023-04-15,39595,Saturday,1,2022/2023,2023,20,38,6,7,25,36,73,-37,25,0.7654754388180326
31,4/15/2023,15:00,wolves,0.8,2:0,1.1,Brentford,30769,molineux stadium,Paul Tierney,2023-04-15,32057,Saturday,1,2022/2023,2023,13,38,11,8,19,31,58,-27,41,0.9598215678322988
31,4/15/2023,15:00,tottenham,2.2,2:3,1.3,Bournemouth,61369,tottenham hotspur stadium,Andy Madley,2023-04-15,32000,Saturday,1,2022/2023,2023,8,38,18,6,14,70,63,7,60,1.0
31,4/15/2023,15:00,everton,1.4,1:3,1.8,Fulham,39241,goodison park,Anthony Taylor,2023-04-15,39595,Saturday,1,2022/2023,2023,17,38,8,12,18,34,57,-23,36,0.991059477206718
31,4/15/2023,17:30,manchester city,1.6,3:1,2.3,Leicester City,53329,etihad stadium,Darren England,2023-04-15,55017,Saturday,1,2022/2023,2023,1,38,28,5,5,94,33,61,89,0.9693185742588655
31,4/16/2023,14:00,west ham,1.8,2:2,2.7,Arsenal,62481,london stadium,David Coote,2023-04-16,60000,Sunday,1,2022/2023,2023,14,38,11,7,20,42,55,-13,40,1.0
31,4/16/2023,16:30,nottingham forest,0.7,0:2,3.5,Manchester Utd,29435,the city ground,Simon Hooper,2023-04-16,39595,Sunday,1,2022/2023,2023,16,38,9,11,18,38,68,-30,38,0.7434019446899861
31,4/17/2023,20:00,leeds united,1.4,1:6,2.7,Liverpool,36657,elland road,Craig Pawson,2023-04-17,39460,Monday,0,2022/2023,2023,19,38,7,10,21,48,78,-30,31,0.9289660415610745
32,4/21/2023,20:00,arsenal,2.5,3:3,1.3,Southampton,60175,emirates stadium,Simon Hooper,2023-04-21,59867,Friday,0,2022/2023,2023,2,38,26,6,6,88,43,45,84,1.0
32,4/22/2023,12:30,fulham,1.7,2:1,0.8,Leeds United,24356,craven cottage,Peter Bankes,2023-04-22,25700,Saturday,1,2022/2023,2023,10,38,15,7,16,55,53,2,52,0.947704280155642
32,4/22/2023,15:00,crystal palace,0.5,0:0,0.4,Everton,25202,selhurst park,John Brooks,2023-04-22,25456,Saturday,1,2022/2023,2023,11,38,11,12,15,40,49,-9,45,0.990021998742929
32,4/22/2023,15:00,brentford,2.7,1:1,1.5,Aston Villa,17098,brentford community stadium,Michael Salisbury,2023-04-22,39595,Saturday,1,2022/2023,2023,9,38,15,14,9,58,46,12,59,0.4318221997726986
32,4/22/2023,15:00,liverpool,2.8,3:2,0.9,Nott'ham Forest,53254,anfield,Michael Oliver,2023-04-22,53394,Saturday,1,2022/2023,2023,5,38,19,10,9,75,47,28,67,0.9973779825448552
32,4/22/2023,15:00,leicester city,2.4,2:1,0.9,Wolves,32053,king power stadium,Andy Madley,2023-04-22,32273,Saturday,1,2022/2023,2023,18,38,9,7,22,51,68,-17,34,0.99318315619868
32,4/23/2023,14:00,bournemouth,1.5,0:4,2.4,West Ham,10465,vitality stadium,Anthony Taylor,2023-04-23,11360,Sunday,1,2022/2023,2023,15,38,11,6,21,37,71,-34,39,0.9212147887323944
32,4/23/2023,14:00,newcastle utd,3.7,6:1,1.0,Tottenham,52252,st james' park,David Coote,2023-04-23,39595,Sunday,1,2022/2023,2023,4,38,19,14,5,68,33,35,71,1.0
33,4/25/2023,19:30,wolves,1.4,2:0,0.8,Crystal Palace,30294,molineux stadium,Robert Jones,2023-04-25,32057,Tuesday,0,2022/2023,2023,13,38,11,8,19,31,58,-27,41,0.9450042112487133
33,4/25/2023,19:45,aston villa,1.0,1:0,0.1,Fulham,41046,villa park,Thomas Bramall,2023-04-25,42682,Tuesday,0,2022/2023,2023,7,38,18,7,13,51,46,5,61,0.961670024834825
33,4/25/2023,20:00,leeds united,1.5,1:1,2.1,Leicester City,36666,elland road,Paul Tierney,2023-04-25,39460,Tuesday,0,2022/2023,2023,19,38,7,10,21,48,78,-30,31,0.9291941206284845
33,4/26/2023,19:30,nottingham forest,2.4,3:1,2.3,Brighton,28808,the city ground,Jarred Gillett,2023-04-26,39595,Wednesday,0,2022/2023,2023,16,38,9,11,18,38,68,-30,38,0.7275666119459527
33,4/26/2023,19:45,chelsea,1.3,0:2,1.1,Brentford,39929,stamford bridge,Andy Madley,2023-04-26,41631,Wednesday,0,2022/2023,2023,12,38,11,11,16,38,47,-9,44,0.9591170041555571
33,4/26/2023,19:45,west ham,0.8,1:2,1.9,Liverpool,62473,london stadium,Chris Kavanagh,2023-04-26,60000,Wednesday,0,2022/2023,2023,14,38,11,7,20,42,55,-13,40,1.0
33,4/26/2023,20:00,manchester city,2.5,4:1,0.5,Arsenal,53482,etihad stadium,Michael Oliver,2023-04-26,55017,Wednesday,0,2022/2023,2023,1,38,28,5,5,94,33,61,89,0.9720995328716578
33,4/27/2023,19:45,everton,0.9,1:4,2.4,Newcastle Utd,39248,goodison park,Andre Marriner,2023-04-27,39595,Thursday,0,2022/2023,2023,17,38,8,12,18,34,57,-23,36,0.9912362672054552
33,4/27/2023,19:45,southampton,0.5,0:1,0.9,Bournemouth,30414,st. mary's stadium,Darren England,2023-04-27,39595,Thursday,0,2022/2023,2023,20,38,6,7,25,36,73,-37,25,0.7681272887990908
33,4/27/2023,20:15,tottenham,2.5,2:2,2.0,Manchester Utd,61586,tottenham hotspur stadium,Anthony Taylor,2023-04-27,32000,Thursday,0,2022/2023,2023,8,38,18,6,14,70,63,7,60,1.0
34,4/29/2023,12:30,crystal palace,2.1,4:3,1.7,West Ham,25148,selhurst park,Craig Pawson,2023-04-29,25456,Saturday,1,2022/2023,2023,11,38,11,12,15,40,49,-9,45,0.9879006913890634
34,4/29/2023,15:00,brighton,3.3,6:0,0.8,Wolves,31584,the american express community stadium,David Coote,2023-04-29,39595,Saturday,1,2022/2023,2023,6,38,18,8,12,72,53,19,62,0.7976764743023109
34,4/29/2023,15:00,brentford,1.6,2:1,0.7,Nott'ham Forest,17080,brentford community stadium,Peter Bankes,2023-04-29,39595,Saturday,1,2022/2023,2023,9,38,15,14,9,58,46,12,59,0.4313675969188029
34,4/30/2023,14:00,manchester utd,1.2,1:0,0.6,Aston Villa,73592,old trafford,Jarred Gillett,2023-04-30,74994,Sunday,1,2022/2023,2023,3,38,23,6,9,58,43,15,75,0.9813051710803531
34,4/30/2023,14:00,bournemouth,1.9,4:1,1.6,Leeds United,10434,vitality stadium,Chris Kavanagh,2023-04-30,11360,Sunday,1,2022/2023,2023,15,38,11,6,21,37,71,-34,39,0.9184859154929578
34,4/30/2023,14:00,newcastle utd,4.3,3:1,0.8,Southampton,52234,st james' park,Anthony Taylor,2023-04-30,39595,Sunday,1,2022/2023,2023,4,38,19,14,5,68,33,35,71,1.0
34,4/30/2023,14:00,fulham,0.2,1:2,2.5,Manchester City,24498,craven cottage,Simon Hooper,2023-04-30,25700,Sunday,1,2022/2023,2023,10,38,15,7,16,55,53,2,52,0.9532295719844358
34,4/30/2023,16:30,liverpool,2.2,4:3,2.0,Tottenham,53275,anfield,Paul Tierney,2023-04-30,53394,Sunday,1,2022/2023,2023,5,38,19,10,9,75,47,28,67,0.997771285163127
34,5/1/2023,20:00,leicester city,3.4,2:2,3.1,Everton,32173,king power stadium,Michael Oliver,2023-05-01,32273,Monday,0,2022/2023,2023,18,38,9,7,22,51,68,-17,34,0.9969014346357636
34,5/2/2023,20:00,arsenal,1.7,3:1,0.8,Chelsea,60144,emirates stadium,Robert Jones,2023-05-02,59867,Tuesday,0,2022/2023,2023,2,38,26,6,6,88,43,45,84,1.0
28,5/3/2023,20:00,liverpool,1.8,1:0,0.9,Fulham,52602,anfield,Stuart Attwell,2023-05-03,53394,Wednesday,0,2022/2023,2023,5,38,19,10,9,75,47,28,67,0.9851668726823238
28,5/3/2023,20:00,manchester city,2.3,3:0,0.4,West Ham,53305,etihad stadium,John Brooks,2023-05-03,55017,Wednesday,0,2022/2023,2023,1,38,28,5,5,94,33,61,89,0.9688823454568588
28,5/4/2023,20:00,brighton,2.3,1:0,1.4,Manchester Utd,31577,the american express community stadium,Andre Marriner,2023-05-04,39595,Thursday,0,2022/2023,2023,6,38,18,8,12,72,53,19,62,0.7974996843035737
35,5/6/2023,15:00,tottenham,0.9,1:0,0.4,Crystal Palace,61093,tottenham hotspur stadium,Darren England,2023-05-06,32000,Saturday,1,2022/2023,2023,8,38,18,6,14,70,63,7,60,1.0
35,5/6/2023,15:00,wolves,0.8,1:0,1.5,Aston Villa,31641,molineux stadium,Stuart Attwell,2023-05-06,32057,Saturday,1,2022/2023,2023,13,38,11,8,19,31,58,-27,41,0.9870231150762704
35,5/6/2023,15:00,bournemouth,1.2,1:3,1.3,Chelsea,10357,vitality stadium,John Brooks,2023-05-06,11360,Saturday,1,2022/2023,2023,15,38,11,6,21,37,71,-34,39,0.9117077464788732
35,5/6/2023,15:00,manchester city,2.6,2:1,0.2,Leeds United,53406,etihad stadium,Andy Madley,2023-05-06,55017,Saturday,1,2022/2023,2023,1,38,28,5,5,94,33,61,89,0.9707181416653035
35,5/6/2023,17:30,liverpool,2.2,1:0,0.2,Brentford,52838,anfield,Anthony Taylor,2023-05-06,53394,Saturday,1,2022/2023,2023,5,38,19,10,9,75,47,28,67,0.9895868449638536
35,5/7/2023,16:30,newcastle utd,1.3,0:2,1.3,Arsenal,50267,st james' park,Chris Kavanagh,2023-05-07,39595,Sunday,1,2022/2023,2023,4,38,19,14,5,68,33,35,71,1.0
35,5/7/2023,19:00,west ham,1.3,1:0,1.2,Manchester Utd,62477,london stadium,Peter Bankes,2023-05-07,60000,Sunday,1,2022/2023,2023,14,38,11,7,20,42,55,-13,40,1.0
35,5/8/2023,15:00,fulham,1.6,5:3,2.8,Leicester City,24442,craven cottage,Robert Jones,2023-05-08,25700,Monday,0,2022/2023,2023,10,38,15,7,16,55,53,2,52,0.9510505836575875
35,5/8/2023,17:30,brighton,3.2,1:5,2.3,Everton,31567,the american express community stadium,Simon Hooper,2023-05-08,39595,Monday,0,2022/2023,2023,6,38,18,8,12,72,53,19,62,0.7972471271625206
35,5/8/2023,20:00,nottingham forest,1.8,4:3,3.1,Southampton,29154,the city ground,Michael Oliver,2023-05-08,39595,Monday,0,2022/2023,2023,16,38,9,11,18,38,68,-30,38,0.7363050890263922
36,5/13/2023,12:30,leeds united,2.1,2:2,2.4,Newcastle Utd,36955,elland road,Simon Hooper,2023-05-13,39460,Saturday,1,2022/2023,2023,19,38,7,10,21,48,78,-30,31,0.9365179929042068
36,5/13/2023,15:00,aston villa,1.2,2:1,1.4,Tottenham,42164,villa park,Peter Bankes,2023-05-13,42682,Saturday,1,2022/2023,2023,7,38,18,7,13,51,46,5,61,0.9878637364697062
36,5/13/2023,15:00,chelsea,1.2,2:2,1.3,Nott'ham Forest,40030,stamford bridge,Paul Tierney,2023-05-13,41631,Saturday,1,2022/2023,2023,12,38,11,11,16,38,47,-9,44,0.961543080877231
36,5/13/2023,15:00,crystal palace,1.5,2:0,0.3,Bournemouth,25034,selhurst park,Michael Salisbury,2023-05-13,25456,Saturday,1,2022/2023,2023,11,38,11,12,15,40,49,-9,45,0.9834223758642363
36,5/13/2023,15:00,southampton,0.4,0:2,1.4,Fulham,28978,st. mary's stadium,Thomas Bramall,2023-05-13,39595,Saturday,1,2022/2023,2023,20,38,6,7,25,36,73,-37,25,0.7318600833438565
36,5/13/2023,15:00,manchester utd,3.2,2:0,0.3,Wolves,73570,old trafford,John Brooks,2023-05-13,74994,Saturday,1,2022/2023,2023,3,38,23,6,9,58,43,15,75,0.9810118142784756
36,5/14/2023,14:00,everton,1.6,0:3,0.8,Manchester City,39376,goodison park,Anthony Taylor,2023-05-14,39595,Sunday,1,2022/2023,2023,17,38,8,12,18,34,57,-23,36,0.9944689986109357
36,5/14/2023,14:00,brentford,3.4,2:0,0.2,West Ham,17075,brentford community stadium,Michael Oliver,2023-05-14,39595,Sunday,1,2022/2023,2023,9,38,15,14,9,58,46,12,59,0.4312413183482763
36,5/14/2023,16:30,arsenal,0.9,0:3,1.7,Brighton,60139,emirates stadium,Andy Madley,2023-05-14,59867,Sunday,1,2022/2023,2023,2,38,26,6,6,88,43,45,84,1.0
36,5/15/2023,20:00,leicester city,0.4,0:3,2.2,Liverpool,32225,king power stadium,Craig Pawson,2023-05-15,32273,Monday,0,2022/2023,2023,18,38,9,7,22,51,68,-17,34,0.9985126886251665
25,5/18/2023,19:30,newcastle utd,3.6,4:1,0.5,Brighton,52122,st james' park,Robert Jones,2023-05-18,39595,Thursday,0,2022/2023,2023,4,38,19,14,5,68,33,35,71,1.0
37,5/20/2023,12:30,tottenham,1.8,1:3,1.3,Brentford,61514,tottenham hotspur stadium,Jarred Gillett,2023-05-20,32000,Saturday,1,2022/2023,2023,8,38,18,6,14,70,63,7,60,1.0
37,5/20/2023,15:00,liverpool,0.7,1:1,1.3,Aston Villa,53306,anfield,John Brooks,2023-05-20,53394,Saturday,1,2022/2023,2023,5,38,19,10,9,75,47,28,67,0.9983518747424804
37,5/20/2023,15:00,fulham,1.7,2:2,1.6,Crystal Palace,24356,craven cottage,Joshua Smith,2023-05-20,25700,Saturday,1,2022/2023,2023,10,38,15,7,16,55,53,2,52,0.947704280155642
37,5/20/2023,15:00,bournemouth,1.0,0:1,1.4,Manchester Utd,10240,vitality stadium,Chris Kavanagh,2023-05-20,11360,Saturday,1,2022/2023,2023,15,38,11,6,21,37,71,-34,39,0.9014084507042254
37,5/20/2023,15:00,wolves,1.6,1:1,2.0,Everton,31684,molineux stadium,David Coote,2023-05-20,32057,Saturday,1,2022/2023,2023,13,38,11,8,19,31,58,-27,41,0.9883644757775213
37,5/20/2023,17:30,nottingham forest,0.6,1:0,0.6,Arsenal,29514,the city ground,Anthony Taylor,2023-05-20,39595,Saturday,1,2022/2023,2023,16,38,9,11,18,38,68,-30,38,0.7453971461043061
37,5/21/2023,13:30,west ham,2.1,3:1,0.9,Leeds United,62478,london stadium,Peter Bankes,2023-05-21,60000,Sunday,1,2022/2023,2023,14,38,11,7,20,42,55,-13,40,1.0
37,5/21/2023,14:00,brighton,2.5,3:1,0.6,Southampton,31507,the american express community stadium,Paul Tierney,2023-05-21,39595,Sunday,1,2022/2023,2023,6,38,18,8,12,72,53,19,62,0.7957317843162015
37,5/21/2023,16:00,manchester city,1.2,1:0,1.2,Chelsea,53490,etihad stadium,Michael Oliver,2023-05-21,55017,Sunday,1,2022/2023,2023,1,38,28,5,5,94,33,61,89,0.9722449424723267
37,5/22/2023,20:00,newcastle utd,2.1,0:0,0.1,Leicester City,52152,st james' park,Andre Marriner,2023-05-22,39595,Monday,0,2022/2023,2023,4,38,19,14,5,68,33,35,71,1.0
32,5/24/2023,20:00,brighton,2.2,1:1,1.8,Manchester City,31388,the american express community stadium,Simon Hooper,2023-05-24,39595,Wednesday,0,2022/2023,2023,6,38,18,8,12,72,53,19,62,0.7927263543376689
32,5/25/2023,20:00,manchester utd,5.2,4:1,1.9,Chelsea,73561,old trafford,Stuart Attwell,2023-05-25,74994,Thursday,0,2022/2023,2023,3,38,23,6,9,58,43,15,75,0.9808918046777075
38,5/28/2023,16:30,crystal palace,1.4,1:1,0.5,Nott'ham Forest,25198,selhurst park,Thomas Bramall,2023-05-28,25456,Sunday,1,2022/2023,2023,11,38,11,12,15,40,49,-9,45,0.9898648648648649
38,5/28/2023,16:30,chelsea,2.2,1:1,1.7,Newcastle Utd,40130,stamford bridge,Jarred Gillett,2023-05-28,41631,Sunday,1,2022/2023,2023,12,38,11,11,16,38,47,-9,44,0.9639451370373039
38,5/28/2023,16:30,manchester utd,2.9,2:1,1.8,Fulham,73465,old trafford,Robert Jones,2023-05-28,74994,Sunday,1,2022/2023,2023,3,38,23,6,9,58,43,15,75,0.9796117022695149
38,5/28/2023,16:30,arsenal,2.8,5:0,0.5,Wolves,60095,emirates stadium,Andre Marriner,2023-05-28,59867,Sunday,1,2022/2023,2023,2,38,26,6,6,88,43,45,84,1.0
38,5/28/2023,16:30,southampton,1.8,4:4,4.0,Liverpool,31129,st. mary's stadium,Darren England,2023-05-28,39595,Sunday,1,2022/2023,2023,20,38,6,7,25,36,73,-37,25,0.7861851243843919
38,5/28/2023,16:30,everton,1.0,1:0,0.5,Bournemouth,39201,goodison park,Stuart Attwell,2023-05-28,39595,Sunday,1,2022/2023,2023,17,38,8,12,18,34,57,-23,36,0.9900492486425053
38,5/28/2023,16:30,leicester city,1.4,2:1,1.4,West Ham,32183,king power stadium,Simon Hooper,2023-05-28,32273,Sunday,1,2022/2023,2023,18,38,9,7,22,51,68,-17,34,0.9972112911721873
38,5/28/2023,16:30,aston villa,2.8,2:1,1.4,Brighton,41679,villa park,David Coote,2023-05-28,42682,Sunday,1,2022/2023,2023,7,38,18,7,13,51,46,5,61,0.9765006325851647
38,5/28/2023,16:30,leeds united,1.5,1:4,2.2,Tottenham,36871,elland road,Anthony Taylor,2023-05-28,39460,Sunday,1,2022/2023,2023,19,38,7,10,21,48,78,-30,31,0.9343892549417131
38,5/28/2023,16:30,brentford,1.3,1:0,1.6,Manchester City,17120,brentford community stadium,John Brooks,2023-05-28,39595,Sunday,1,2022/2023,2023,9,38,15,14,9,58,46,12,59,0.4323778254830155
1,8/13/2021,20:00,brentford,1.2,2:0,1.3,Arsenal,16479,brentford community stadium,Michael Oliver,2021-08-13,39595,Friday,0,2021/2022,2022,13,38,13,7,18,48,56,-8,46,0.41618891274150777
1,8/14/2021,12:30,manchester utd,1.5,5:1,0.5,Leeds United,72732,old trafford,Paul Tierney,2021-08-14,74994,Saturday,1,2021/2022,2022,6,38,16,10,12,57,57,0,58,0.9698375870069605
1,8/14/2021,15:00,leicester city,0.5,1:0,1.3,Wolves,31983,king power stadium,Craig Pawson,2021-08-14,32273,Saturday,1,2021/2022,2022,8,38,14,10,14,62,59,3,52,0.9910141604437146
1,8/14/2021,15:00,burnley,1.5,1:2,1.0,Brighton,16910,turf moor,David Coote,2021-08-14,21944,Saturday,1,2021/2022,2022,18,38,7,14,17,34,53,-19,35,0.7705978855267955
1,8/14/2021,15:00,chelsea,0.7,3:0,0.2,Crystal Palace,38965,stamford bridge,Jonathan Moss,2021-08-14,41631,Saturday,1,2021/2022,2022,3,38,21,11,6,76,33,43,74,0.9359611827724532
1,8/14/2021,15:00,watford,1.2,3:2,1.2,Aston Villa,20051,vicarage road stadium,Mike Dean,2021-08-14,39595,Saturday,1,2021/2022,2022,19,38,6,5,27,34,77,-43,23,0.5064023235256977
1,8/14/2021,15:00,everton,2.4,3:1,0.8,Southampton,38487,goodison park,Andy Madley,2021-08-14,39595,Saturday,1,2021/2022,2022,16,38,11,6,21,43,66,-23,39,0.9720166687713095
1,8/14/2021,17:30,norwich city,1.4,0:3,1.6,Liverpool,27023,carrow road,Andre Marriner,2021-08-14,27033,Saturday,1,2021/2022,2022,20,38,5,7,26,23,84,-61,22,0.9996300817519328
1,8/15/2021,14:00,newcastle utd,1.8,2:4,2.7,West Ham,50673,st. james' park,Martin Atkinson,2021-08-15,39595,Sunday,1,2021/2022,2022,11,38,13,10,15,44,62,-18,49,1.0
1,8/15/2021,16:30,tottenham,1.0,1:0,1.8,Manchester City,58262,tottenham hotspur stadium,Anthony Taylor,2021-08-15,32000,Sunday,1,2021/2022,2022,4,38,22,5,11,69,40,29,71,1.0
2,8/21/2021,12:30,liverpool,2.7,2:0,0.9,Burnley,52591,anfield,Mike Dean,2021-08-21,53394,Saturday,1,2021/2022,2022,2,38,28,8,2,94,26,68,92,0.9849608570251339
2,8/21/2021,15:00,aston villa,1.2,2:0,0.7,Newcastle Utd,41964,villa park,David Coote,2021-08-21,42682,Saturday,1,2021/2022,2022,14,38,13,6,19,52,54,-2,45,0.9831779204348438
2,8/21/2021,15:00,manchester city,2.6,5:0,0.1,Norwich City,51437,etihad stadium,Graham Scott,2021-08-21,55017,Saturday,1,2021/2022,2022,1,38,29,6,3,99,26,73,93,0.9349292037006743
2,8/21/2021,15:00,leeds united,1.2,2:2,1.8,Everton,36293,elland road,Darren England,2021-08-21,39460,Saturday,1,2021/2022,2022,17,38,9,11,18,42,79,-37,38,0.9197415103902686
2,8/21/2021,15:00,crystal palace,0.5,0:0,0.9,Brentford,23091,selhurst park,Martin Atkinson,2021-08-21,25456,Saturday,1,2021/2022,2022,12,38,11,15,12,50,46,4,48,0.9070945945945946
2,8/21/2021,17:30,brighton,1.3,2:0,0.5,Watford,29485,the american express community stadium,Anthony Taylor,2021-08-21,39595,Saturday,1,2021/2022,2022,9,38,12,15,11,42,44,-2,51,0.7446647303952519
2,8/22/2021,14:00,wolves,1.7,0:1,1.7,Tottenham,30368,molineux stadium,Stuart Attwell,2021-08-22,32057,Sunday,1,2021/2022,2022,10,38,15,6,17,38,43,-5,51,0.9473125994322613
2,8/22/2021,14:00,southampton,0.7,1:1,1.8,Manchester Utd,32000,st. mary's stadium,Craig Pawson,2021-08-22,39595,Sunday,1,2021/2022,2022,15,38,9,13,16,43,67,-24,40,0.8081828513701225
2,8/22/2021,16:30,arsenal,0.3,0:2,3.1,Chelsea,58729,emirates stadium,Paul Tierney,2021-08-22,59867,Sunday,1,2021/2022,2022,5,38,22,3,13,61,48,13,69,0.9809911971536907
2,8/23/2021,20:00,west ham,2.3,4:1,0.6,Leicester City,59901,london stadium,Michael Oliver,2021-08-23,60000,Monday,0,2021/2022,2022,7,38,16,8,14,60,51,9,56,0.99835
3,8/28/2021,12:30,manchester city,4.4,5:0,0.2,Arsenal,52276,etihad stadium,Martin Atkinson,2021-08-28,55017,Saturday,1,2021/2022,2022,1,38,29,6,3,99,26,73,93,0.9501790355708236
3,8/28/2021,15:00,norwich city,1.5,1:2,1.5,Leicester City,26765,carrow road,Robert Jones,2021-08-28,27033,Saturday,1,2021/2022,2022,20,38,5,7,26,23,84,-61,22,0.9900861909517996
3,8/28/2021,15:00,west ham,1.3,2:2,1.1,Crystal Palace,59751,london stadium,Stuart Attwell,2021-08-28,60000,Saturday,1,2021/2022,2022,7,38,16,8,14,60,51,9,56,0.99585
3,8/28/2021,15:00,aston villa,0.7,1:1,0.9,Brentford,42045,villa park,Peter Bankes,2021-08-28,42682,Saturday,1,2021/2022,2022,14,38,13,6,19,52,54,-2,45,0.9850756759289631
3,8/28/2021,15:00,newcastle utd,1.0,2:2,3.6,Southampton,44017,st. james' park,Paul Tierney,2021-08-28,39595,Saturday,1,2021/2022,2022,11,38,13,10,15,44,62,-18,49,1.0
3,8/28/2021,15:00,brighton,0.7,0:2,1.4,Everton,30548,the american express community stadium,Jonathan Moss,2021-08-28,39595,Saturday,1,2021/2022,2022,9,38,12,15,11,42,44,-2,51,0.7715115544892032
3,8/28/2021,17:30,liverpool,2.5,1:1,0.6,Chelsea,54000,anfield,Anthony Taylor,2021-08-28,53394,Saturday,1,2021/2022,2022,2,38,28,8,2,94,26,68,92,1.0
3,8/29/2021,14:00,burnley,1.0,1:1,1.2,Leeds United,20000,turf moor,Michael Oliver,2021-08-29,21944,Sunday,1,2021/2022,2022,18,38,7,14,17,34,53,-19,35,0.911410864017499
3,8/29/2021,14:00,tottenham,1.0,1:0,0.8,Watford,57672,tottenham hotspur stadium,Andre Marriner,2021-08-29,32000,Sunday,1,2021/2022,2022,4,38,22,5,11,69,40,29,71,1.0
3,8/29/2021,16:30,wolves,2.1,0:1,0.6,Manchester Utd,30621,molineux stadium,Mike Dean,2021-08-29,32057,Sunday,1,2021/2022,2022,10,38,15,6,17,38,43,-5,51,0.9552047914652027
4,9/11/2021,12:30,crystal palace,2.1,3:0,0.1,Tottenham,26000,selhurst park,Jonathan Moss,2021-09-11,25456,Saturday,1,2021/2022,2022,12,38,11,15,12,50,46,4,48,1.0
4,9/11/2021,15:00,watford,0.2,0:2,2.2,Wolves,20019,vicarage road stadium,Peter Bankes,2021-09-11,39595,Saturday,1,2021/2022,2022,19,38,6,5,27,34,77,-43,23,0.5055941406743276
4,9/11/2021,15:00,brentford,0.4,0:1,0.3,Brighton,16518,brentford community stadium,Graham Scott,2021-09-11,39595,Saturday,1,2021/2022,2022,13,38,13,7,18,48,56,-8,46,0.4171738855916151
4,9/11/2021,15:00,arsenal,2.7,1:0,0.7,Norwich City,58000,emirates stadium,Michael Oliver,2021-09-11,59867,Saturday,1,2021/2022,2022,5,38,22,3,13,61,48,13,69,0.9688142048206858
4,9/11/2021,15:00,manchester utd,2.5,4:1,0.4,Newcastle Utd,72732,old trafford,Anthony Taylor,2021-09-11,74994,Saturday,1,2021/2022,2022,6,38,16,10,12,57,57,0,58,0.9698375870069605
4,9/11/2021,15:00,leicester city,0.6,0:1,2.8,Manchester City,32087,king power stadium,Paul Tierney,2021-09-11,32273,Saturday,1,2021/2022,2022,8,38,14,10,14,62,59,3,52,0.9942366684225203
4,9/11/2021,15:00,southampton,0.7,0:0,0.7,West Ham,30000,st. mary's stadium,David Coote,2021-09-11,39595,Saturday,1,2021/2022,2022,15,38,9,13,16,43,67,-24,40,0.7576714231594899
4,9/11/2021,17:30,chelsea,1.3,3:0,1.2,Aston Villa,39969,stamford bridge,Stuart Attwell,2021-09-11,41631,Saturday,1,2021/2022,2022,3,38,21,11,6,76,33,43,74,0.9600778266195864
4,9/12/2021,16:30,leeds united,1.2,0:3,4.3,Liverpool,36507,elland road,Craig Pawson,2021-09-12,39460,Sunday,1,2021/2022,2022,17,38,9,11,18,42,79,-37,38,0.9251647237709072
4,9/13/2021,20:00,everton,1.4,3:1,1.0,Burnley,30000,goodison park,Martin Atkinson,2021-09-13,39595,Monday,0,2021/2022,2022,16,38,11,6,21,43,66,-23,39,0.7576714231594899
5,9/17/2021,20:00,newcastle utd,1.3,1:1,1.5,Leeds United,50407,st. james' park,Mike Dean,2021-09-17,39595,Friday,0,2021/2022,2022,11,38,13,10,15,44,62,-18,49,1.0
5,9/18/2021,12:30,wolves,0.6,0:2,2.5,Brentford,30000,molineux stadium,Darren England,2021-09-18,32057,Saturday,1,2021/2022,2022,10,38,15,6,17,38,43,-5,51,0.9358330473843466
5,9/18/2021,15:00,manchester city,1.0,0:0,0.4,Southampton,52698,etihad stadium,Jonathan Moss,2021-09-18,55017,Saturday,1,2021/2022,2022,1,38,29,6,3,99,26,73,93,0.9578493920061072
5,9/18/2021,15:00,liverpool,3.1,3:0,0.6,Crystal Palace,52000,anfield,Andy Madley,2021-09-18,53394,Saturday,1,2021/2022,2022,2,38,28,8,2,94,26,68,92,0.9738921976252013
5,9/18/2021,15:00,norwich city,1.0,1:3,2.4,Watford,26649,carrow road,Robert Jones,2021-09-18,27033,Saturday,1,2021/2022,2022,20,38,5,7,26,23,84,-61,22,0.9857951392742204
5,9/18/2021,15:00,burnley,1.0,0:1,1.1,Arsenal,20000,turf moor,Anthony Taylor,2021-09-18,21944,Saturday,1,2021/2022,2022,18,38,7,14,17,34,53,-19,35,0.911410864017499
5,9/18/2021,17:30,aston villa,0.8,3:0,0.7,Everton,41888,villa park,Craig Pawson,2021-09-18,42682,Saturday,1,2021/2022,2022,14,38,13,6,19,52,54,-2,45,0.9813973103415959
5,9/19/2021,14:00,west ham,1.6,1:2,2.0,Manchester Utd,60000,london stadium,Martin Atkinson,2021-09-19,60000,Sunday,1,2021/2022,2022,7,38,16,8,14,60,51,9,56,1.0
5,9/19/2021,14:00,brighton,1.7,2:1,1.6,Leicester City,31078,the american express community stadium,Stuart Attwell,2021-09-19,39595,Sunday,1,2021/2022,2022,9,38,12,15,11,42,44,-2,51,0.7848970829650208
5,9/19/2021,16:30,tottenham,0.5,0:3,2.1,Chelsea,60059,tottenham hotspur stadium,Paul Tierney,2021-09-19,32000,Sunday,1,2021/2022,2022,4,38,22,5,11,69,40,29,71,1.0
6,9/25/2021,12:30,manchester utd,2.2,0:1,1.0,Aston Villa,72922,old trafford,Mike Dean,2021-09-25,74994,Saturday,1,2021/2022,2022,6,38,16,10,12,57,57,0,58,0.9723711230231752
6,9/25/2021,12:30,chelsea,0.2,0:1,1.7,Manchester City,40036,stamford bridge,Michael Oliver,2021-09-25,41631,Saturday,1,2021/2022,2022,3,38,21,11,6,76,33,43,74,0.9616872042468353
6,9/25/2021,15:00,leicester city,2.4,2:2,0.5,Burnley,31650,king power stadium,Chris Kavanagh,2021-09-25,32273,Saturday,1,2021/2022,2022,8,38,14,10,14,62,59,3,52,0.9806959377808074
6,9/25/2021,15:00,leeds united,1.2,1:2,1.6,West Ham,36417,elland road,Kevin Friend,2021-09-25,39460,Saturday,1,2021/2022,2022,17,38,9,11,18,42,79,-37,38,0.9228839330968069
6,9/25/2021,15:00,watford,0.9,1:1,1.9,Newcastle Utd,20650,vicarage road stadium,Jarred Gillett,2021-09-25,39595,Saturday,1,2021/2022,2022,19,38,6,5,27,34,77,-43,23,0.5215304962747822
6,9/25/2021,15:00,everton,1.9,2:0,0.5,Norwich City,38821,goodison park,David Coote,2021-09-25,39595,Saturday,1,2021/2022,2022,16,38,11,6,21,43,66,-23,39,0.9804520772824852
6,9/25/2021,17:30,brentford,2.1,3:3,2.8,Liverpool,16876,brentford community stadium,Stuart Attwell,2021-09-25,39595,Saturday,1,2021/2022,2022,13,38,13,7,18,48,56,-8,46,0.42621543124131833
6,9/26/2021,14:00,southampton,1.0,0:1,1.0,Wolves,28002,st. mary's stadium,Andy Madley,2021-09-26,39595,Sunday,1,2021/2022,2022,15,38,9,13,16,43,67,-24,40,0.7072105063770678
6,9/26/2021,16:30,arsenal,1.1,3:1,1.0,Tottenham,59919,emirates stadium,Craig Pawson,2021-09-26,59867,Sunday,1,2021/2022,2022,5,38,22,3,13,61,48,13,69,1.0
6,9/27/2021,20:00,crystal palace,1.4,1:1,0.8,Brighton,22975,selhurst park,Andre Marriner,2021-09-27,25456,Monday,0,2021/2022,2022,12,38,11,15,12,50,46,4,48,0.9025377121307354
7,10/2/2021,12:30,manchester utd,1.0,1:1,1.3,Everton,73128,old trafford,Michael Oliver,2021-10-02,74994,Saturday,1,2021/2022,2022,6,38,16,10,12,57,57,0,58,0.9751180094407552
7,10/2/2021,15:00,wolves,1.0,2:1,0.6,Newcastle Utd,30483,molineux stadium,Graham Scott,2021-10-02,32057,Saturday,1,2021/2022,2022,10,38,15,6,17,38,43,-5,51,0.9508999594472346
7,10/2/2021,15:00,burnley,1.2,0:0,0.6,Norwich City,17427,turf moor,Kevin Friend,2021-10-02,21944,Saturday,1,2021/2022,2022,18,38,7,14,17,34,53,-19,35,0.7941578563616478
7,10/2/2021,15:00,chelsea,3.3,3:1,1.3,Southampton,40109,stamford bridge,Martin Atkinson,2021-10-02,41631,Saturday,1,2021/2022,2022,3,38,21,11,6,76,33,43,74,0.9634407052436886
7,10/2/2021,15:00,leeds united,1.3,1:0,0.2,Watford,36261,elland road,Simon Hooper,2021-10-02,39460,Saturday,1,2021/2022,2022,17,38,9,11,18,42,79,-37,38,0.9189305625950329
7,10/2/2021,17:30,brighton,1.1,0:0,0.4,Arsenal,31266,the american express community stadium,Jonathan Moss,2021-10-02,39595,Saturday,1,2021/2022,2022,9,38,12,15,11,42,44,-2,51,0.7896451572168203
7,10/3/2021,14:00,tottenham,1.3,2:1,1.2,Aston Villa,53076,tottenham hotspur stadium,Chris Kavanagh,2021-10-03,32000,Sunday,1,2021/2022,2022,4,38,22,5,11,69,40,29,71,1.0
7,10/3/2021,14:00,crystal palace,1.5,2:2,1.2,Leicester City,25000,selhurst park,Anthony Taylor,2021-10-03,25456,Sunday,1,2021/2022,2022,12,38,11,15,12,50,46,4,48,0.9820867379006913
7,10/3/2021,14:00,west ham,1.5,1:2,1.2,Brentford,49940,london stadium,Peter Bankes,2021-10-03,60000,Sunday,1,2021/2022,2022,7,38,16,8,14,60,51,9,56,0.8323333333333334
7,10/3/2021,16:30,liverpool,0.9,2:2,1.2,Manchester City,53102,anfield,Paul Tierney,2021-10-03,53394,Sunday,1,2021/2022,2022,2,38,28,8,2,94,26,68,92,0.9945312207364123
8,10/16/2021,12:30,watford,0.5,0:5,3.3,Liverpool,21085,vicarage road stadium,Jonathan Moss,2021-10-16,39595,Saturday,1,2021/2022,2022,19,38,6,5,27,34,77,-43,23,0.5325167319105948
8,10/16/2021,15:00,leicester city,2.4,4:2,1.2,Manchester Utd,32219,king power stadium,Craig Pawson,2021-10-16,32273,Saturday,1,2021/2022,2022,8,38,14,10,14,62,59,3,52,0.9983267747033123
8,10/16/2021,15:00,manchester city,2.1,2:0,0.9,Burnley,52711,etihad stadium,Martin Atkinson,2021-10-16,55017,Saturday,1,2021/2022,2022,1,38,29,6,3,99,26,73,93,0.9580856826071942
8,10/16/2021,15:00,southampton,1.9,1:0,0.2,Leeds United,30506,st. mary's stadium,David Coote,2021-10-16,39595,Saturday,1,2021/2022,2022,15,38,9,13,16,43,67,-24,40,0.7704508144967799
8,10/16/2021,15:00,aston villa,1.0,2:3,2.0,Wolves,41951,villa park,Michael Oliver,2021-10-16,42682,Saturday,1,2021/2022,2022,14,38,13,6,19,52,54,-2,45,0.9828733423925776
8,10/16/2021,15:00,norwich city,1.2,0:0,0.8,Brighton,26777,carrow road,Peter Bankes,2021-10-16,27033,Saturday,1,2021/2022,2022,20,38,5,7,26,23,84,-61,22,0.9905300928494802
8,10/16/2021,17:30,brentford,1.4,0:1,0.3,Chelsea,16940,brentford community stadium,Anthony Taylor,2021-10-16,39595,Saturday,1,2021/2022,2022,13,38,13,7,18,48,56,-8,46,0.4278317969440586
8,10/17/2021,14:00,everton,0.9,0:1,1.2,West Ham,39132,goodison park,Stuart Attwell,2021-10-17,39595,Sunday,1,2021/2022,2022,16,38,11,6,21,43,66,-23,39,0.9883066043692386
8,10/17/2021,16:30,newcastle utd,0.4,2:3,1.7,Tottenham,52214,st. james' park,Andre Marriner,2021-10-17,39595,Sunday,1,2021/2022,2022,11,38,13,10,15,44,62,-18,49,1.0
8,10/18/2021,20:00,arsenal,1.7,2:2,0.7,Crystal Palace,59475,emirates stadium,Mike Dean,2021-10-18,59867,Monday,0,2021/2022,2022,5,38,22,3,13,61,48,13,69,0.9934521522708671
9,10/22/2021,20:00,arsenal,2.7,3:1,1.4,Aston Villa,59496,emirates stadium,Craig Pawson,2021-10-22,59867,Friday,0,2021/2022,2022,5,38,22,3,13,61,48,13,69,0.993802929827785
9,10/23/2021,12:30,chelsea,3.1,7:0,0.1,Norwich City,40113,stamford bridge,Andy Madley,2021-10-23,41631,Saturday,1,2021/2022,2022,3,38,21,11,6,76,33,43,74,0.9635367874900915
9,10/23/2021,15:00,leeds united,1.6,1:1,0.9,Wolves,36475,elland road,Robert Jones,2021-10-23,39460,Saturday,1,2021/2022,2022,17,38,9,11,18,42,79,-37,38,0.9243537759756716
9,10/23/2021,15:00,crystal palace,1.9,1:1,0.3,Newcastle Utd,24609,selhurst park,Darren England,2021-10-23,25456,Saturday,1,2021/2022,2022,12,38,11,15,12,50,46,4,48,0.9667269013199246
9,10/23/2021,15:00,everton,1.5,2:5,3.7,Watford,38834,goodison park,Graham Scott,2021-10-23,39595,Saturday,1,2021/2022,2022,16,38,11,6,21,43,66,-23,39,0.9807804015658542
9,10/23/2021,15:00,southampton,1.6,2:2,0.7,Burnley,29145,st. mary's stadium,Chris Kavanagh,2021-10-23,39595,Saturday,1,2021/2022,2022,15,38,9,13,16,43,67,-24,40,0.7360777875994444
9,10/23/2021,17:30,brighton,1.3,1:4,3.8,Manchester City,31215,the american express community stadium,Kevin Friend,2021-10-23,39595,Saturday,1,2021/2022,2022,9,38,12,15,11,42,44,-2,51,0.7883571157974492
9,10/24/2021,14:00,west ham,1.3,1:0,0.7,Tottenham,59924,london stadium,Paul Tierney,2021-10-24,60000,Sunday,1,2021/2022,2022,7,38,16,8,14,60,51,9,56,0.9987333333333334
9,10/24/2021,14:00,brentford,1.0,1:2,1.5,Leicester City,16814,brentford community stadium,Simon Hooper,2021-10-24,39595,Sunday,1,2021/2022,2022,13,38,13,7,18,48,56,-8,46,0.42464957696678873
9,10/24/2021,16:30,manchester utd,1.6,0:5,3.4,Liverpool,73088,old trafford,Anthony Taylor,2021-10-24,74994,Sunday,1,2021/2022,2022,6,38,16,10,12,57,57,0,58,0.9745846334373417
10,10/30/2021,12:30,leicester city,1.3,0:2,0.7,Arsenal,32209,king power stadium,Michael Oliver,2021-10-30,32273,Saturday,1,2021/2022,2022,8,38,14,10,14,62,59,3,52,0.9980169181668888
10,10/30/2021,15:00,newcastle utd,0.2,0:3,2.2,Chelsea,52208,st. james' park,Paul Tierney,2021-10-30,39595,Saturday,1,2021/2022,2022,11,38,13,10,15,44,62,-18,49,1.0
10,10/30/2021,15:00,liverpool,1.5,2:2,1.0,Brighton,52598,anfield,Mike Dean,2021-10-30,53394,Saturday,1,2021/2022,2022,2,38,28,8,2,94,26,68,92,0.9850919578978912
10,10/30/2021,15:00,burnley,2.3,3:1,0.8,Brentford,18821,turf moor,Jonathan Moss,2021-10-30,21944,Saturday,1,2021/2022,2022,18,38,7,14,17,34,53,-19,35,0.8576831935836675
10,10/30/2021,15:00,watford,1.0,0:1,1.8,Southampton,20869,vicarage road stadium,Peter Bankes,2021-10-30,39595,Saturday,1,2021/2022,2022,19,38,6,5,27,34,77,-43,23,0.5270614976638465
10,10/30/2021,15:00,manchester city,0.7,0:2,0.7,Crystal Palace,53014,etihad stadium,Andre Marriner,2021-10-30,55017,Saturday,1,2021/2022,2022,1,38,29,6,3,99,26,73,93,0.9635930712325281
10,10/30/2021,17:30,tottenham,1.0,0:3,1.5,Manchester Utd,60356,tottenham hotspur stadium,Stuart Attwell,2021-10-30,32000,Saturday,1,2021/2022,2022,4,38,22,5,11,69,40,29,71,1.0
10,10/31/2021,14:00,norwich city,0.8,1:2,0.7,Leeds United,26913,carrow road,Anthony Taylor,2021-10-31,27033,Sunday,1,2021/2022,2022,20,38,5,7,26,23,84,-61,22,0.9955609810231939
10,10/31/2021,16:30,aston villa,0.7,1:4,2.3,West Ham,41874,villa park,Chris Kavanagh,2021-10-31,42682,Sunday,1,2021/2022,2022,14,38,13,6,19,52,54,-2,45,0.9810693032191556
10,11/1/2021,20:00,wolves,1.7,2:1,1.5,Everton,30617,molineux stadium,Martin Atkinson,2021-11-01,32057,Monday,0,2021/2022,2022,10,38,15,6,17,38,43,-5,51,0.9550800137255514
11,11/5/2021,20:00,southampton,0.6,1:0,0.6,Aston Villa,30178,st. mary's stadium,Andy Madley,2021-11-05,39595,Friday,0,2021/2022,2022,15,38,9,13,16,43,67,-24,40,0.7621669402702361
11,11/6/2021,12:30,manchester utd,0.9,0:2,1.6,Manchester City,73086,old trafford,Michael Oliver,2021-11-06,74994,Saturday,1,2021/2022,2022,6,38,16,10,12,57,57,0,58,0.9745579646371709
11,11/6/2021,15:00,brentford,2.5,1:2,1.2,Norwich City,16837,brentford community stadium,Jarred Gillett,2021-11-06,39595,Saturday,1,2021/2022,2022,13,38,13,7,18,48,56,-8,46,0.425230458391211
11,11/6/2021,15:00,chelsea,1.8,1:1,0.7,Burnley,39798,stamford bridge,Andre Marriner,2021-11-06,41631,Saturday,1,2021/2022,2022,3,38,21,11,6,76,33,43,74,0.9559703105858615
11,11/6/2021,15:00,crystal palace,1.9,2:0,0.3,Wolves,24390,selhurst park,Graham Scott,2021-11-06,25456,Saturday,1,2021/2022,2022,12,38,11,15,12,50,46,4,48,0.9581238214959146
11,11/6/2021,17:30,brighton,1.5,1:1,0.3,Newcastle Utd,31267,the american express community stadium,David Coote,2021-11-06,39595,Saturday,1,2021/2022,2022,9,38,12,15,11,42,44,-2,51,0.7896704129309257
11,11/7/2021,14:00,everton,0.6,0:0,0.7,Tottenham,39059,goodison park,Chris Kavanagh,2021-11-07,39595,Sunday,1,2021/2022,2022,16,38,11,6,21,43,66,-23,39,0.9864629372395505
11,11/7/2021,14:00,leeds united,1.3,1:1,0.7,Leicester City,36478,elland road,Darren England,2021-11-07,39460,Sunday,1,2021/2022,2022,17,38,9,11,18,42,79,-37,38,0.9244298023314749
11,11/7/2021,14:00,arsenal,1.6,1:0,0.5,Watford,59833,emirates stadium,Kevin Friend,2021-11-07,59867,Sunday,1,2021/2022,2022,5,38,22,3,13,61,48,13,69,0.9994320744316568
11,11/7/2021,16:30,west ham,1.0,3:2,1.2,Liverpool,59909,london stadium,Craig Pawson,2021-11-07,60000,Sunday,1,2021/2022,2022,7,38,16,8,14,60,51,9,56,0.9984833333333333
12,11/20/2021,12:30,leicester city,0.4,0:3,2.0,Chelsea,35497,king power stadium,Paul Tierney,2021-11-20,32273,Saturday,1,2021/2022,2022,8,38,14,10,14,62,59,3,52,1.0
12,11/20/2021,15:00,wolves,1.4,1:0,0.4,West Ham,30667,molineux stadium,Mike Dean,2021-11-20,32057,Saturday,1,2021/2022,2022,10,38,15,6,17,38,43,-5,51,0.956639735471192
12,11/20/2021,15:00,watford,2.7,4:1,1.4,Manchester Utd,21087,vicarage road stadium,Jonathan Moss,2021-11-20,39595,Saturday,1,2021/2022,2022,19,38,6,5,27,34,77,-43,23,0.5325672433388055
12,11/20/2021,15:00,norwich city,0.5,2:1,1.0,Southampton,26885,carrow road,Martin Atkinson,2021-11-20,27033,Saturday,1,2021/2022,2022,20,38,5,7,26,23,84,-61,22,0.9945252099286058
12,11/20/2021,15:00,aston villa,0.7,2:0,0.4,Brighton,41925,villa park,Anthony Taylor,2021-11-20,42682,Saturday,1,2021/2022,2022,14,38,13,6,19,52,54,-2,45,0.9822641863080456
12,11/20/2021,15:00,newcastle utd,1.5,3:3,0.9,Brentford,52131,st. james' park,Robert Jones,2021-11-20,39595,Saturday,1,2021/2022,2022,11,38,13,10,15,44,62,-18,49,1.0
12,11/20/2021,15:00,burnley,1.5,3:3,1.9,Crystal Palace,18028,turf moor,Simon Hooper,2021-11-20,21944,Saturday,1,2021/2022,2022,18,38,7,14,17,34,53,-19,35,0.8215457528253737
12,11/20/2021,17:30,liverpool,4.3,4:0,0.4,Arsenal,53092,anfield,Michael Oliver,2021-11-20,53394,Saturday,1,2021/2022,2022,2,38,28,8,2,94,26,68,92,0.9943439337753306
12,11/21/2021,14:00,manchester city,2.5,3:0,0.2,Everton,52571,etihad stadium,Stuart Attwell,2021-11-21,55017,Sunday,1,2021/2022,2022,1,38,29,6,3,99,26,73,93,0.9555410145954887
12,11/21/2021,16:30,tottenham,2.1,2:1,1.4,Leeds United,58989,tottenham hotspur stadium,Andre Marriner,2021-11-21,32000,Sunday,1,2021/2022,2022,4,38,22,5,11,69,40,29,71,1.0
13,11/27/2021,12:30,arsenal,2.5,2:0,0.3,Newcastle Utd,59886,emirates stadium,Stuart Attwell,2021-11-27,59867,Saturday,1,2021/2022,2022,5,38,22,3,13,61,48,13,69,1.0
13,11/27/2021,15:00,crystal palace,1.0,1:2,0.5,Aston Villa,25203,selhurst park,Michael Salisbury,2021-11-27,25456,Saturday,1,2021/2022,2022,12,38,11,15,12,50,46,4,48,0.990061282212445
13,11/27/2021,15:00,liverpool,2.9,4:0,1.0,Southampton,53040,anfield,Andre Marriner,2021-11-27,53394,Saturday,1,2021/2022,2022,2,38,28,8,2,94,26,68,92,0.9933700415777054
13,11/27/2021,15:00,norwich city,1.6,0:0,0.3,Wolves,26911,carrow road,Simon Hooper,2021-11-27,27033,Saturday,1,2021/2022,2022,20,38,5,7,26,23,84,-61,22,0.9954869973735805
13,11/27/2021,17:30,brighton,2.1,0:0,0.6,Leeds United,31166,the american express community stadium,Craig Pawson,2021-11-27,39595,Saturday,1,2021/2022,2022,9,38,12,15,11,42,44,-2,51,0.7871195858062887
13,11/28/2021,14:00,brentford,1.2,1:0,1.0,Everton,16957,brentford community stadium,Darren England,2021-11-28,39595,Sunday,1,2021/2022,2022,13,38,13,7,18,48,56,-8,46,0.42826114408384897
13,11/28/2021,14:00,leicester city,2.1,4:2,2.8,Watford,32020,king power stadium,Andy Madley,2021-11-28,32273,Sunday,1,2021/2022,2022,8,38,14,10,14,62,59,3,52,0.9921606296284821
13,11/28/2021,14:00,manchester city,2.1,2:1,0.2,West Ham,53245,etihad stadium,Michael Oliver,2021-11-28,55017,Sunday,1,2021/2022,2022,1,38,29,6,3,99,26,73,93,0.9677917734518422
13,11/28/2021,16:30,chelsea,2.7,1:1,0.9,Manchester Utd,40041,stamford bridge,Anthony Taylor,2021-11-28,41631,Sunday,1,2021/2022,2022,3,38,21,11,6,76,33,43,74,0.961807307054839
14,11/30/2021,19:30,newcastle utd,1.1,1:1,1.2,Norwich City,50757,st. james' park,Andy Madley,2021-11-30,39595,Tuesday,0,2021/2022,2022,11,38,13,10,15,44,62,-18,49,1.0
14,11/30/2021,20:15,leeds united,1.4,1:0,1.1,Crystal Palace,35558,elland road,Kevin Friend,2021-11-30,39460,Tuesday,0,2021/2022,2022,17,38,9,11,18,42,79,-37,38,0.9011150532184491
14,12/1/2021,19:30,southampton,1.5,2:2,1.5,Leicester City,26951,st. mary's stadium,Robert Jones,2021-12-01,39595,Wednesday,0,2021/2022,2022,15,38,9,13,16,43,67,-24,40,0.6806667508523804
14,12/1/2021,19:30,west ham,1.3,1:1,1.3,Brighton,59626,london stadium,Chris Kavanagh,2021-12-01,60000,Wednesday,0,2021/2022,2022,7,38,16,8,14,60,51,9,56,0.9937666666666667
14,12/1/2021,19:30,wolves,0.7,0:0,0.2,Burnley,30328,molineux stadium,John Brooks,2021-12-01,32057,Wednesday,0,2021/2022,2022,10,38,15,6,17,38,43,-5,51,0.9460648220357488
14,12/1/2021,19:30,watford,1.0,1:2,0.9,Chelsea,20388,vicarage road stadium,David Coote,2021-12-01,39595,Wednesday,0,2021/2022,2022,19,38,6,5,27,34,77,-43,23,0.5149134991791893
14,12/1/2021,20:15,aston villa,0.8,1:2,1.0,Manchester City,41400,villa park,Mike Dean,2021-12-01,42682,Wednesday,0,2021/2022,2022,14,38,13,6,19,52,54,-2,45,0.9699639192165316
14,12/1/2021,20:15,everton,0.7,1:4,2.4,Liverpool,39641,goodison park,Paul Tierney,2021-12-01,39595,Wednesday,0,2021/2022,2022,16,38,11,6,21,43,66,-23,39,1.0
14,12/2/2021,19:30,tottenham,1.9,2:0,0.3,Brentford,54202,tottenham hotspur stadium,Jonathan Moss,2021-12-02,32000,Thursday,0,2021/2022,2022,4,38,22,5,11,69,40,29,71,1.0
14,12/2/2021,20:15,manchester utd,1.9,3:2,1.4,Arsenal,73123,old trafford,Martin Atkinson,2021-12-02,74994,Thursday,0,2021/2022,2022,6,38,16,10,12,57,57,0,58,0.9750513374403286
15,12/4/2021,12:30,west ham,1.8,3:2,1.1,Chelsea,59942,london stadium,Andre Marriner,2021-12-04,60000,Saturday,1,2021/2022,2022,7,38,16,8,14,60,51,9,56,0.9990333333333333
15,12/4/2021,15:00,newcastle utd,1.0,1:0,0.6,Burnley,51948,st. james' park,Paul Tierney,2021-12-04,39595,Saturday,1,2021/2022,2022,11,38,13,10,15,44,62,-18,49,1.0
15,12/4/2021,15:00,southampton,1.6,1:1,1.6,Brighton,28706,st. mary's stadium,Anthony Taylor,2021-12-04,39595,Saturday,1,2021/2022,2022,15,38,9,13,16,43,67,-24,40,0.7249905291072105
15,12/4/2021,15:00,wolves,0.1,0:1,2.7,Liverpool,30729,molineux stadium,Chris Kavanagh,2021-12-04,32057,Saturday,1,2021/2022,2022,10,38,15,6,17,38,43,-5,51,0.9585737904357863
15,12/4/2021,17:30,watford,0.8,1:3,3.1,Manchester City,20673,vicarage road stadium,Simon Hooper,2021-12-04,39595,Saturday,1,2021/2022,2022,19,38,6,5,27,34,77,-43,23,0.5221113776992045
15,12/5/2021,14:00,leeds united,1.2,2:2,1.0,Brentford,35639,elland road,David Coote,2021-12-05,39460,Sunday,1,2021/2022,2022,17,38,9,11,18,42,79,-37,38,0.9031677648251394
15,12/5/2021,14:00,tottenham,1.6,3:0,1.2,Norwich City,57088,tottenham hotspur stadium,Jarred Gillett,2021-12-05,32000,Sunday,1,2021/2022,2022,4,38,22,5,11,69,40,29,71,1.0
15,12/5/2021,14:00,manchester utd,0.9,1:0,0.5,Crystal Palace,73172,old trafford,Craig Pawson,2021-12-05,74994,Sunday,1,2021/2022,2022,6,38,16,10,12,57,57,0,58,0.9757047230445103
15,12/5/2021,16:30,aston villa,2.1,2:1,1.1,Leicester City,41572,villa park,Michael Oliver,2021-12-05,42682,Sunday,1,2021/2022,2022,14,38,13,6,19,52,54,-2,45,0.9739937210065133
15,12/6/2021,20:00,everton,0.9,2:1,1.0,Arsenal,38906,goodison park,Mike Dean,2021-12-06,39595,Monday,0,2021/2022,2022,16,38,11,6,21,43,66,-23,39,0.982598812981437
16,12/10/2021,20:00,brentford,1.6,2:1,0.5,Watford,16861,brentford community stadium,Michael Oliver,2021-12-10,39595,Friday,0,2021/2022,2022,13,38,13,7,18,48,56,-8,46,0.4258365955297386
16,12/11/2021,12:30,manchester city,3.2,1:0,0.2,Wolves,52613,etihad stadium,Jonathan Moss,2021-12-11,55017,Saturday,1,2021/2022,2022,1,38,29,6,3,99,26,73,93,0.9563044149990003
16,12/11/2021,15:00,liverpool,2.2,1:0,0.2,Aston Villa,53093,anfield,Stuart Attwell,2021-12-11,53394,Saturday,1,2021/2022,2022,2,38,28,8,2,94,26,68,92,0.9943626624714388
16,12/11/2021,15:00,arsenal,1.8,3:0,0.6,Southampton,59653,emirates stadium,Jarred Gillett,2021-12-11,59867,Saturday,1,2021/2022,2022,5,38,22,3,13,61,48,13,69,0.9964254096580754
16,12/11/2021,15:00,chelsea,2.5,3:2,1.4,Leeds United,39959,stamford bridge,Chris Kavanagh,2021-12-11,41631,Saturday,1,2021/2022,2022,3,38,21,11,6,76,33,43,74,0.9598376210035791
16,12/11/2021,17:30,norwich city,1.2,0:1,2.0,Manchester Utd,27606,carrow road,Darren England,2021-12-11,27033,Saturday,1,2021/2022,2022,20,38,5,7,26,23,84,-61,22,1.0
16,12/12/2021,14:00,burnley,0.8,0:0,0.8,West Ham,18065,turf moor,Graham Scott,2021-12-12,21944,Sunday,1,2021/2022,2022,18,38,7,14,17,34,53,-19,35,0.823231862923806
16,12/12/2021,14:00,leicester city,2.6,4:0,1.0,Newcastle Utd,31959,king power stadium,Peter Bankes,2021-12-12,32273,Sunday,1,2021/2022,2022,8,38,14,10,14,62,59,3,52,0.9902705047562979
16,12/12/2021,16:30,crystal palace,1.8,3:1,1.0,Everton,24066,selhurst park,Andy Madley,2021-12-12,25456,Sunday,1,2021/2022,2022,12,38,11,15,12,50,46,4,48,0.9453959773727215
17,12/14/2021,19:45,norwich city,0.5,0:2,2.0,Aston Villa,26836,carrow road,David Coote,2021-12-14,27033,Tuesday,0,2021/2022,2022,20,38,5,7,26,23,84,-61,22,0.9927126105130766
17,12/14/2021,20:00,manchester city,3.1,7:0,0.3,Leeds United,52401,etihad stadium,Paul Tierney,2021-12-14,55017,Tuesday,0,2021/2022,2022,1,38,29,6,3,99,26,73,93,0.9524510605812749
17,12/15/2021,19:30,brighton,1.2,0:1,1.0,Wolves,30362,the american express community stadium,Tony Harrington,2021-12-15,39595,Wednesday,0,2021/2022,2022,9,38,12,15,11,42,44,-2,51,0.7668139916656144
17,12/15/2021,19:30,crystal palace,1.2,2:2,0.6,Southampton,22861,selhurst park,Simon Hooper,2021-12-15,25456,Wednesday,0,2021/2022,2022,12,38,11,15,12,50,46,4,48,0.8980593966059083
17,12/15/2021,20:00,arsenal,2.8,2:0,0.4,West Ham,59777,emirates stadium,Anthony Taylor,2021-12-15,59867,Wednesday,0,2021/2022,2022,5,38,22,3,13,61,48,13,69,0.9984966676132093
17,12/16/2021,19:45,chelsea,2.9,1:1,0.6,Everton,13933,stamford bridge,Michael Oliver,2021-12-16,41631,Thursday,0,2021/2022,2022,3,38,21,11,6,76,33,43,74,0.33467848478297424
17,12/16/2021,20:00,liverpool,2.7,3:1,0.3,Newcastle Utd,52951,anfield,Mike Dean,2021-12-16,53394,Thursday,0,2021/2022,2022,2,38,28,8,2,94,26,68,92,0.9917031876240776
18,12/18/2021,17:30,leeds united,1.6,1:4,3.5,Arsenal,36166,elland road,Andre Marriner,2021-12-18,39460,Saturday,1,2021/2022,2022,17,38,9,11,18,42,79,-37,38,0.916523061327927
18,12/19/2021,14:00,wolves,0.2,0:0,0.9,Chelsea,30631,molineux stadium,David Coote,2021-12-19,32057,Sunday,1,2021/2022,2022,10,38,15,6,17,38,43,-5,51,0.9555167358143307
18,12/19/2021,14:15,newcastle utd,0.3,0:4,2.9,Manchester City,52127,st. james' park,Martin Atkinson,2021-12-19,39595,Sunday,1,2021/2022,2022,11,38,13,10,15,44,62,-18,49,1.0
18,12/19/2021,16:30,tottenham,3.0,2:2,1.1,Liverpool,45421,tottenham hotspur stadium,Paul Tierney,2021-12-19,32000,Sunday,1,2021/2022,2022,4,38,22,5,11,69,40,29,71,1.0
19,12/26/2021,15:00,west ham,1.6,2:3,1.2,Southampton,41027,london stadium,Kevin Friend,2021-12-26,60000,Sunday,1,2021/2022,2022,7,38,16,8,14,60,51,9,56,0.6837833333333333
19,12/26/2021,15:00,manchester city,3.6,6:3,2.7,Leicester City,53226,etihad stadium,Chris Kavanagh,2021-12-26,55017,Sunday,1,2021/2022,2022,1,38,29,6,3,99,26,73,93,0.9674464256502535
19,12/26/2021,15:00,norwich city,0.1,0:5,2.5,Arsenal,26940,carrow road,Graham Scott,2021-12-26,27033,Sunday,1,2021/2022,2022,20,38,5,7,26,23,84,-61,22,0.9965597602929752
19,12/26/2021,15:00,tottenham,2.3,3:0,0.2,Crystal Palace,40539,tottenham hotspur stadium,Jonathan Moss,2021-12-26,32000,Sunday,1,2021/2022,2022,4,38,22,5,11,69,40,29,71,1.0
19,12/26/2021,17:30,aston villa,0.4,1:3,2.6,Chelsea,41907,villa park,Martin Atkinson,2021-12-26,42682,Sunday,1,2021/2022,2022,14,38,13,6,19,52,54,-2,45,0.981842462864908
19,12/26/2021,20:00,brighton,0.8,2:0,0.7,Brentford,30141,the american express community stadium,Darren England,2021-12-26,39595,Sunday,1,2021/2022,2022,9,38,12,15,11,42,44,-2,51,0.7612324788483394
19,12/27/2021,20:00,newcastle utd,1.3,1:1,1.6,Manchester Utd,52178,st. james' park,Craig Pawson,2021-12-27,39595,Monday,0,2021/2022,2022,11,38,13,10,15,44,62,-18,49,1.0
20,12/28/2021,15:00,southampton,0.4,1:1,2.3,Tottenham,31304,st. mary's stadium,Anthony Taylor,2021-12-28,39595,Tuesday,0,2021/2022,2022,15,38,9,13,16,43,67,-24,40,0.7906048743528223
20,12/28/2021,15:00,crystal palace,1.9,3:0,0.9,Norwich City,24433,selhurst park,Paul Tierney,2021-12-28,25456,Tuesday,0,2021/2022,2022,12,38,11,15,12,50,46,4,48,0.9598130106851037
20,12/28/2021,15:00,watford,1.6,1:4,3.6,West Ham,20073,vicarage road stadium,Darren England,2021-12-28,39595,Tuesday,0,2021/2022,2022,19,38,6,5,27,34,77,-43,23,0.5069579492360147
20,12/28/2021,20:00,leicester city,0.4,1:0,2.3,Liverpool,32230,king power stadium,Michael Oliver,2021-12-28,32273,Tuesday,0,2021/2022,2022,8,38,14,10,14,62,59,3,52,0.9986676168933784
20,12/29/2021,19:30,chelsea,0.7,1:1,0.9,Brighton,40080,stamford bridge,Mike Dean,2021-12-29,41631,Wednesday,0,2021/2022,2022,3,38,21,11,6,76,33,43,74,0.9627441089572675
20,12/29/2021,20:15,brentford,0.4,0:1,1.1,Manchester City,17009,brentford community stadium,David Coote,2021-12-29,39595,Wednesday,0,2021/2022,2022,13,38,13,7,18,48,56,-8,46,0.4295744412173254
20,12/30/2021,20:15,manchester utd,2.4,3:1,1.1,Burnley,73121,old trafford,Jonathan Moss,2021-12-30,74994,Thursday,0,2021/2022,2022,6,38,16,10,12,57,57,0,58,0.9750246686401579
21,1/1/2022,12:30,arsenal,0.8,1:2,2.0,Manchester City,59757,emirates stadium,Stuart Attwell,2022-01-01,59867,Saturday,1,2021/2022,2022,5,38,22,3,13,61,48,13,69,0.998162593749478
21,1/1/2022,15:00,watford,0.3,0:1,2.2,Tottenham,20391,vicarage road stadium,Robert Jones,2022-01-01,39595,Saturday,1,2021/2022,2022,19,38,6,5,27,34,77,-43,23,0.5149892663215052
21,1/1/2022,17:30,crystal palace,2.4,2:3,2.2,West Ham,24351,selhurst park,Darren England,2022-01-01,25456,Saturday,1,2021/2022,2022,12,38,11,15,12,50,46,4,48,0.9565917661847895
21,1/2/2022,14:00,leeds united,1.9,3:1,1.0,Burnley,36083,elland road,Paul Tierney,2022-01-02,39460,Sunday,1,2021/2022,2022,17,38,9,11,18,42,79,-37,38,0.9144196654840344
21,1/2/2022,14:00,brentford,0.6,2:1,0.8,Aston Villa,16876,brentford community stadium,Craig Pawson,2022-01-02,39595,Sunday,1,2021/2022,2022,13,38,13,7,18,48,56,-8,46,0.42621543124131833
